"Pirate Brands, LLC f/k/a Robert's American Gourmet Food100 Roslyn AvenueSea Cliff, NY 11579",Snack Food Producer,Oyster Bay | WIB Name: OYSTER BAY| Region: Long Island,55,55,7/9/2013,10/8/2013 or within 14 days thereafter,10/22/2013,Economic,Plant Closing,Plant Closing,Affected employees will not have any bumping rights; nor are any employees represented by a union.,"Andy Choffo, Vice President of Human Resources",(973) 630-6433,4201
"Pfizer Inc.64 Maple StreetRouses Point, NY 12979",Pharmaceuticals,Clinton | WIB Name: C-E-F-H| Region: North Country Region,-----,4,7/9/2013,10/19/2013,12/31/2013,Economic,Plant Closing,Plant Closing,Local 95c International Chemical Workers Union/UFCW,"Elaine Reynolds, Senior Manager, Human Resources",(518) 297-1697,4200
,Children's Services,Richmond | WIB Name: NEW YORK CITY| Region: New York City,34,34,7/8/2013,Will commence on 7/5/2013.,7/5/2013,Economic,Plant Closing,Plant Closing,There are no bumping rights for employees affected by this decision.,"Meaghan Chmura, Vice President, Human Resources",(212) 886-4037,4199
,Medical Laboratories,Kings/Bronx/Richmond | WIB Name: NEW YORK CITY| Region: New York City,238,238,2/19/2013 Amended 7/8/2013,Some layoffs will be postponed to occur during the 14-day period between 7/2/2013 and 7/15/2013,approximately 7/1/2013,Sale of company's assets,Plant Closing,Plant Closing,1199SEIU,"Peter Stein, Executive Vice President",(212) 254- 2300 Ext 5132,4198
,Financial Services,New York | WIB Name: NEW YORK CITY| Region: New York City,-----,32,7/8/2013,9/30/2013,-----,Economic,Plant Layoff,Plant Layoff,Employees will not have any bumping rights.,"Anthony Pratofiorito, Head of Human Resources",(212) 671-6481,4197
"Lake Grove SchoolBox 712, Moriches RoadLake Grove, NY 11755",School,Suffolk | WIB Name: SUFFOLK| Region: Long Island,99,99,6/20/2013Amended: 7/2/2013,Layoffs will occur between 6/24/2013 through closing date of 9/9/2013,9/9/2013,Economic,Plant Closing,Plant Closing,SEIU. No bumping rights exist.,"Douglas W. Burns, Chief Financial Officer",(631) 585-8776,4196
"Buena Vista Books, Inc. d/b/a Hyperion1500 Broadway, 3rd FloorNew York, NY 10036",Book Publisher,New York | WIB Name: NEW YORK CITY| Region: New York City,33,33,7/1/2013,Some employees will be retained after the closing date of 9/26/2013 to assist in the winding down of its operations.,on or about 9/26/2013,Economic,Plant Closing,Plant Closing,"None of the affected employees are represented by a union or other labor organization, nor are they entitled to bumping rights pursuant to a collective bargaining agreement or otherwise.","Christiane Sentianin, Manager, Human Resources",(212) 456-6768,4195
"Kaye Scholer LLP425 Park AvenueNew York, NY 10022",Law firm,New York | WIB Name: NEW YORK CITY| Region: New York City,total number yet to be confirmed,2,4/4/2013Amended 7/1/2013,9/3/2013,7/31/2014,"Relocation of Administrative/Support staff to Tallahassee, Florida",Plant Unit Closing,Plant Unit Closing,None of the affected employees are members of a labor organization.,"Dana Morgan, Human Resources Manager",(212) 836-8330,4194
"Petri Baking Products, Inc.18 Main StreetSilver Creek, NY 14136",Bakery and Bakery Products,Chautauqua | WIB Name: CHAUTAUQUA| Region: Western Region,143,143,1/3/2013 Amended 7/1/2013,"Layoffs began on 6/15/2013. Layoffs postponed for 23 employees to assist with final shut down activities and will take place on 7/3/2013 (1), 7/12/3013 (21), and 8/16/2013 (1) or within 14 days of these dates.",6/28/13,Economic,Plant Closing,Plant Closing,The employees are not represented by a union.,"Alice Clark, Vice President, Labor and Employee Relations",(314) 877-7189,4193
"SuperMedia LLC, a Dex Media, Inc.16 Corporate Woods BlvdAlbany, NY 12211",Publishing Operations,Albany | WIB Name: CAPITAL DISTRICT | Region: Capital Region,2,2 remaining workers will be terminated on 10/1/2013,6/28/2013,10/1/2013,6/28/2013,Economic,Plant Unit Closing,Plant Unit Closing,IBEW 2213 (the two affected workers remaining are non-union),"Carl Mitchell, HR Business Partner/New England",(978) 762-1794,4191
"CGM-GH, LLC d/b/a Toy18 Ninth AvenueNew York, NY 10014",Restaurant,New York | WIB Name: NEW YORK CITY | Region: New York City,125,125,6/27/2013,----,6/27/2013,Renovations and successor take over of restaurant space.,Plant Closing,Plant Closing,Non-union,"Nataliya Omelchenko, Bookkeeper",(212) 660-6710,4190
"Sykes Enterprises, Incorporated (Amherst Call Center)251 John James Audubon ParkwayAmherst, NY 14228",Call Center,Erie | WIB Name: ERIE | Region: Western Region,310,65,6/25/2013,9/25/2013,-----,Discontinuance of client account operations,Plant Layoff,Plant Layoff,Affected workers are not represented by a union and bumping rights do not exist.,"Shannon Allen, Area HR Manager",(970) 281-2618,4189
"Xerox Business Services @ Xerox Federal Government Solutions501 Bleeker StreetUtica, NY",Administrative support staff involved in Federal Student Loans,Oneida | WIB Name: HMO| Region: Mohawk Valley Region,304,55,5/17/2013 Amended: 6/25/2013,second phase of closing - 8/30/2013,December 2013,Loss of Service Contract,Plant Unit Closing,Plant Unit Closing,-----,"Janelle R. Burns, SPHR, Sr. HR Consultant",(801) 567-5466,4188
"Xerox Business Services @ Xerox Federal Government Solutions501 Bleeker StreetUtica, NY",Administrative support staff involved in Federal Student Loans,Oneida | WIB Name: HMO| Region: Mohawk Valley Region,304,149,4/6/2013 Amended: 6/25/2013,Will commence on 7/19/2013 and should conclude on or around 8/1/2013,8/1/2013,Loss of Contract with Department of Education,Plant Layoff,Plant Closing,-----,"Janelle R. Burns, SPHR, Sr. HR Consultant",(801) 567-5466,4187
"Xerox Business Services @ Xerox Federal Government Solutions501 Bleeker StreetUtica, NY 13501",Administrative support staff involved in Federal Student Loans,Oneida | WIB Name: HMO | Region: Mohawk Valley Region,304,12,6/21/2013 Amended: 6/25/2013,9/27/2013,12/31/2013,Loss of Service Contract,Plant Unit Closing,Plant Unit Closing,Non-union,"Diane L. Wright, SPHR",(315) 738-2359,4186
"Cornell University - Animal Science Teaching and Research Center681 Cornell LaneDryden, NY 13053",Teaching and Research Center,Tompkins | WIB Name: TOMPKINS| Region: Southern Region,37,37,2/25/2013 Amended: 6/24/2013,-----,Closing date postponed from 8/1/2013 to 9/1/2013.,Contracting out services,Plant Closing,Plant Closing,UAW local 2300,"Tony Caudill, Director CALS Human Resources",(607) 255-5644,4185
"Xerox Business Services @ Xerox Federal Government Solutions501 Bleeker StreetUtica, NY 13501",Administrative support staff involved in Federal Student Loans,Oneida | WIB Name: HMO | Region: Mohawk Valley Region,158,12,6/21/2013,9/27/2013,12/31/2013,Loss of Service Contract,Plant Unit Closing,Plant Unit Closing,Non-union,"Diane L. Wright, SPHR",(315) 738-2359,4184
"BorgWarner Morse TEC/Powerdered Metal Operation (PMO)3690 Luker RoadCortland, NY 13045",Automobile parts manufacturing & testing,Cortland | WIB Name: CAYUGA/CORT| Region: Central RegionCounty: Tompkins / WIB Name: TOMPKINS /Region: Southern Region,-----,25,1/18/2013Amended: 6/24/2013,Layoffs will occur between 5/10/2013 and 10/31/2013.,Production will cease on 6/14/2013 and plant closing will occur by10/31/2013,Economic,Plant Closing,Plant Closing,Teamsters Local 317,"Michael Rubino, Senior Manager, Human Resources and Labor Relations",(607) 266-5247,4182
"Kaye Scholer LLP425 Park AvenueNew York, NY 10022",Law firm,New York | WIB Name: NEW YORK CITY | Region: New York City,total number yet to be confirmed,6,6/20/2013,Between 9/3/2013 and 9/20/2013,7/31/2014,"Relocation of Administrative/Support staff to Tallahassee, Florida",Plant Unit Closing,Plant Unit Closing,None of the affected employees are members of a labor organization.,"Dana Morgan, Human Resources Manager",(212) 836-8330,4181
"BorgWarner Morse TEC/Powerdered Metal Operation (PMO)3690 Luker RoadCortland, NY 13045",Automobile parts manufacturing & testing,Cortland | WIB Name: CAYUGA/CORT | Region: Central RegionCounty: Tompkins / WIB Name: TOMPKINS /Region: Southern Region,-----,25,1/18/2013 Amended: 6/20/2013,Layoffs will occur between 5/10/2013 and 10/31/2013.,Production will cease on 6/14/2013 and plant closing will occur on 10/31/2013,Economic,Plant Closing,Plant Closing,Teamsters Local 317,"Michael Rubino, Senior Manager, Human Resources and Labor Relations",(607) 266-5247,4180
"Lake Grove SchoolBox 712, Moriches RoadLake Grove, NY 11755",School,Suffolk | WIB Name: SUFFOLK | Region: Long Island,99,99,6/20/2013,Layoffs will occur between 6/24/2013 through closing date of 9/9/2013,9/9/2013,Economic,Plant Closing,Plant Closing,No bumping rights exist.,"Douglas W. Burns, Chief Financial Officer",(631) 585-8776,4179
"Bendiner & Schlesinger, Inc. Medical Laboratories Headquarters140 58th Street, Brooklyn Army Terminal, Bldg B, Unit 8DBrooklyn, NY 11220",Medical Laboratories,Kings/Bronx/Richmond | WIB Name: NEW YORK CITY | Region: New York CityWestchester | WIB Name: WESTCHESTER | Region: Mid-Hudson Region,238,238,2/19/2013 Amended 6/20/2013,Some layoffs will be postponed to occur during the 14-day period between 6/18/2013 and 7/1/2013,approximately 7/1/2013,Sale of company's assets,Plant Closing,Plant Closing,1199SEIU,"Peter Stein, Executive Vice President",(212) 254- 2300 Ext 5132,4178
"Southeastern Container, Inc.115 Airport DriveWappingers Falls, NY 12590",Beverage Bottling Manufacturing,Dutchess | WIB Name: DUTCHESS | Region: Mid-Hudson Region,-----,31,6/20/2013,------,9/21/2013,Economic,Plant Closing,Plant Closing,No bumping rights available and no union representation.,"Joaquin Gonzales, General Manager",(845) 463-3935 x 8203,4177
"Archcare, Inc. @ Kateri Residence150 Riverside DriveNew York, NY 10024",Skilled Nursing Facility,New York | WIB Name: NEW YORK CITY | Region: New York City,555,555,12/3/2012 Amended 6/20/2013,-----,Sale has been postponed to occur on 8/1/2013,Sale of facility,Plant Closing,Plant Closing,1199 SEIU,"Hugo A. Pizarro, Vice President, Human Resources",(646) 633-4422,4176
"SUNY Downstate Medical Center at LICH - StaffCo.339 Hicks StreetBrooklyn, NY 11201",Medical Center,Kings | WIB Name: NEW YORK CITY | Region: New York City,1666,1666,3/25/2013 Amended 6/18/2013,Layoffs are postponed to occur between 8/1/2013 and 8/14/2013,postponed to occur between 8/1/2013 and 8/14/2013,Economic,Plant Closing,Plant Closing,"1199 SEIU United Healthcare Workers East, New York State Nurses Association","Francesca Tinti, Assistant Vice President for Human Resources",(718) 780-1500,4175
"Daikin McQuay4900 Technology Park BoulevardAuburn, NY 13021",Air conditioning manufacturing,Cayuga | WIB Name: CAYUGA/CORT| Region: Central Region,307,307,6/18/2013,"Will occur in phases between 9/23/2013 and 10/4/2013 and 3/2014, 8/2014 & 12/31/2014.",12/31/2014,Economic,Plant Closing,Plant Closing,"United Steelworkers, Local 32","Elizabeth J. Hoey, Director, Human Resources",(315) 282-6296,4174
"Durso Associates, Inc.1769 Second AvenueNew York, NY 10128",Supermarket,New York | WIB Name: NEW YORK CITY| Region: New York City,73,73,6/19/2013,-----,9/15/2013,Economic,Plant Closing,Plant Closing,"Local 338 RWDSU/UFCW & Local 342, UFCW","Frank Durso, General Store Manager",(201) 692-9411,4173
"GDF SUEZ Energy North America, Inc. @ the Syracuse Energy Corp Plant56 Industrial DriveSyracuse, NY 13204",Energy Company,Onondaga | WIB Name: ONONDAGA| Region: Central Region,24,24,6/17/2013,-----,Layoffs and closing will occur within a 90 window beginning on or after 9/12/2013.,Economic,Plant Closing,Plant Closing,Employees do not have bumping rights.,"Frank Dobrinski, Director of Human Resources",(617) 866-8728,4172
"Sodexo, Inc. (at Merrill Lynch)225 Liberty Street, 3rd Floor CaféNew York, NY 10280",Café Food Services,New York | WIB Name: NEW YORK CITY | Region: New York City,32,32,6/14/2013,Initial separations will occur on 6/28/2013.,"Sodexo, Inc. will close on 6/28/2013and separations will begin same day. The remaining Catering and Kiosk operations are scheduled to close on or about August/September 2013.",Loss of contract with Merrill Lynch,Plant Closing,Plant Closing,Unite Here Local 100,"Ms. Mahlet Tesfatsion, Senior HR Manager",(646) 957-3290,4171
"JPMorgan Chase & Co. Mortgage Bank Default Operations (Call Center)231 East AvenueAlbion, NY 14411",Call Center,Orleans | WIB Name: GLOW| Region: Finger Lakes Region,-----,412,6/7/2013Amended 6/12/2013,-----,9/9/2013,Economic,Plant Closing,Plant Closing,"The affected employees are not represented by a union, and bumping rights do not exist.","Caren S. Feldman, Corporate Employee Relations",(201) 599-6647,4170
"Knight Capital Americas LLC320 Park AvenueNew York, NY 10022",Broker/Dealer for equity securities,New York | WIB Name: NEW YORK CITY | Region: New York City,-----,15,6/12/2013,First separations occurred on 3/28/2013,-----,Economic,Plant Layoff,Plant Layoff,No bumping rights exist.,"Bronwen Bastone, Senior Managing Director – Human Resources",(201) 557-6861,4169
"International Business Machines Corporation (IBM)2070 Route 52Hopewell Junction, NY 12533",Computer Mfg,Dutchess | WIB Name: DUTCHESS | Region: Mid-Hudson Region,-----,369,6/12/2013,9/10/2013,-----,Economic,Plant Layoff,Plant Layoff,No bumping rights exist,Diego Chiarandini/ Michael Dale,(845) 894-4326/(845) 435-1833,4168
"The Vestal Group, Inc.123 William Street, Suite 1700New York, NY 10038",Affinity Shopper Marketing Organization,New York | WIB Name: NEW YORK CITY| Region: New York City,-----,4,6/2/2013Amended 6/12/2013,Will occur on 7/31/2013,-----,Contract Loss,Plant Closing,Plant Closing,Employees do not have bumping rights and there is no bargaining unit involved.,Lisa Laporte,(248) 223-8937,4167
"Studio Imprint, Inc.123 William Street, Suite 1700New York, NY 10038",Printing,New York | WIB Name: NEW YORK CITY| Region: New York City,-----,3,6/2/2013Amended 6/12/2013,Will occur on 7/31/2013,-----,Contract Loss,Plant Closing,Plant Closing,Employees do not have bumping rights and there is no bargaining unit involved.,Lisa Laporte,(248) 223-8937,4166
"GHV of NY, Inc.123 William Street, Suite 1700New York, NY 10038",Media and events company,New York | WIB Name: NEW YORK CITY| Region: New York City,-----,4,6/4/2013Amended 6/12/2013,Will occur on 7/31/2013,-----,Contract Loss,Possible Plant Closing,Possible Plant Closing,Employees do not have bumping rights and there is no bargaining unit involved.,Lisa Laporte,(248) 223-8937,4165
"From A to Si Translations123 William Street, Suite 1700New York, NY 10038",Translation Services,New York | WIB Name: NEW YORK CITY| Region: New York City,\-----,2,6/2/2013Amended 6/12/2013,Will occur on 7/31/2013,-----\,Contract Loss,Plant Closing,Plant Closing,Employees do not have bumping rights and there is no bargaining unit involved.,Lisa Laporte,(248) 223-8937,4164
"Don Coleman Advertising, Inc. d/b/a GlobalHue123 William Street, Suite 1700New York, NY 10038",Advertising agency,New York | WIB Name: NEW YORK CITY| Region: New York City,-----,61,6/2/2013Amended 6/12/2013,Will occur on 7/31/2013,-----,Contract Loss,Possible Plant Closing,Possible Plant Closing,Employees do not have bumping rights and there is no bargaining unit involved.,Lisa Laporte,(248) 223-8937,4163
,Financial Services,New York | WIB Name: NEW YORK CITY| Region: New York City,-----,4,6/2/2013 Amended 6/11/2013,Will occur between 7/31/2013 and 9/13/2013,-----,Contract Loss,Plant Layoff,Plant Layoff,Employees do not have bumping rights and there is no bargaining unit involved.,Lisa Laporte,(248) 223-8937,4160
,Printing,New York | WIB Name: NEW YORK CITY| Region: New York City,-----,3,6/2/2013  Amended 6/11/2013,Will occur between 7/31/2013 and 9/13/2013,-----,Contract Loss,Plant Layoff,Plant Layoff,Employees do not have bumping rights and there is no bargaining unit involved.,Lisa Laporte,(248) 223-8937,4159
,Translation Services,New York | WIB Name: NEW YORK CITY| Region: New York City,-----,2,6/2/2013  Amended 6/11/2013,Will occur between 7/31/2013 and 9/13/2013,-----,Contract Loss,Plant Layoff,Plant Layoff,Employees do not have bumping rights and there is no bargaining unit involved.,Lisa Laporte,(248) 223-8937,4158
,Financial Services,New York | WIB Name: NEW YORK CITY| Region: New York City,-----,4,6/4/2013  Amended 6/11/2013,Will occur between 7/31/2013 and 9/13/2013,-----,Contract Loss,Plant Layoff,Plant Layoff,Employees do not have bumping rights and there is no bargaining unit involved.,Lisa Laporte,(248) 223-8937,4157
,Advertising agency,New York | WIB Name: NEW YORK CITY| Region: New York City,-----,61,6/2/2013 Amended 6/11/2013,Will occur between 7/31/2013 and 9/13/2013,-----,Contract Loss,Plant Layoff,Plant Layoff,Employees do not have bumping rights and there is no bargaining unit involved.,Lisa Laporte,(248) 223-8937,4156
"JPMorgan Chase & Co. Mortgage Bank Originations Operations4 Chase MetroTech CenterBrooklyn, NY 11245",Mortgage Bank Originations Operations,New York | WIB Name: NEW YORK CITY | Region: New York City,-----,35,6/7/2013,-----,9/4/2013,Economic,Plant Unit Closing,Plant Unit Closing,"The affected employees are not represented by a union, and bumping rights do not exist.","Caren S. Feldman, Corporate Employee Relations",(201) 599-6647,4152
"JPMorgan Chase & Co. Mortgage Bank Default Operations (Call Center)231 East AvenueAlbion, NY 14411",Call Center,Orleans | WIB Name: GLOW | Region: Finger Lakes Region,-----,412,6/7/2013,-----,9/4/2013,Economic,Plant Unit Closing,Plant Unit Closing,"The affected employees are not represented by a union, and bumping rights do not exist.","Caren S. Feldman, Corporate Employee Relations",(201) 599-6647,4151
"Zynga Inc. (Zynga Mobile)632 Broadway, 11th FloorNew York, NY 10012",Developer/maker of on-line social games,New York | WIB Name: NEW YORK CITY | Region: New York City,56,56,6/7/2013,6/3/2013,8/2/2013,Economic,Plant Closing,Plant Closing,The affected employees are not represented by a union.,Amanda Spitz,(954) 232-0695,4150
"Eastman Kodak Company (Eastman Park)1669 Lake AvenueRochester, NY 14650",Photographic equipment and Supplies,Monroe | WIB Name: MONROE | Region: Finger Lakes Region,-----,61,6/6/2013,8/28/2013,-----,Economic,Plant Layoff,Plant Layoff,The affected employees are not represented by a union. Bumping rights do exist.,"Mary C. Lazzar-Whyte, Director, HR Americas Employee Services",(585) 781-1896,4148
"Totsy, Inc.75 Broad Street, 15th FloorNew York, NY 10004",Children's clothing,New York | WIB Name: NEW YORK CITY| Region: New York City,83,83,5/16/2013Amended 6/4/2013,some layoffs have been postponed to occur on 6/24/2013 or within the 14 days thereafter,5/31/2013,Economic,Plant Closing,Plant Closing,No bumping rights exist. No employees are represented by a union.,"Lisa Kennedy, Chief Executive Officer",(212) 729-0342,4146
"GHV of NY, Inc.123 William Street, Suite 1700New York, NY 10038",Financial Services,New York | WIB Name: NEW YORK CITY| Region: New York City,-----,4,6/4/2013,Will occur between 8/30/2013 and 9/13/2013,-----,Possible Contract Loss,Potential Plant Layoff,Potential Plant Layoff,Employees do not have bumping rights and there is no bargaining unit involved.,Lisa Laporte,(248) 223-8937,4145
"Bendiner & Schlesinger, Inc. Medical Laboratories Headquarters140 58th Street, Brooklyn Army Terminal, Bldg B, Unit 8DBrooklyn, NY 11220",Medical Laboratories,Kings/Bronx/Richmond | WIB Name: NEW YORK CITY| Region: New York CityWestchester | WIB Name: WESTCHESTER| Region: Mid-Hudson Region,238,238,2/19/2013Amended 6/2/2013,Some layoffs will be postponed to occur during the 14-day period between 6/3/2013 and 6/17/2013,approximately 5/15/2013,Sale of company's assets,Plant Closing,Plant Closing,1199SEIU,"Peter Stein, Executive Vice President",(212) 254- 2300 Ext 5132,4144
"From A to Si Translations123 William Street, Suite 1700New York, NY 10038",Translation Services,New York | WIB Name: NEW YORK CITY| Region: New York City,-----,2,6/2/2013,Will occur between 8/30/2013 and 9/13/2013,-----,Possible Contract Loss,Potential Plant Layoff,Potential Plant Layoff,Employees do not have bumping rights and there is no bargaining unit involved.,Lisa Laporte,(248) 223-8937,4143
"Studio Imprint, Inc.123 William Street, Suite 1700New York, NY 10038",Printing Services,New York | WIB Name: NEW YORK CITY| Region: New York City,-----,3,6/2/2013,Will occur between 8/30/2013 and 9/13/2013,-----,Possible Contract Loss,Potential Plant Layoff,Potential Plant Layoff,Employees do not have bumping rights and there is no bargaining unit involved.,Lisa Laporte,(248) 223-8937,4142
"The Vestal Group, Inc.123 William Street, Suite 1700New York, NY 10038",Financial Services,New York | WIB Name: NEW YORK CITY| Region: New York City,-----,4,6/2/2013,Will occur between 8/30/2013 and 9/13/2013,-----,Possible Contract Loss,Potential Plant Layoff,Potential Plant Layoff,Employees do not have bumping rights and there is no bargaining unit involved.,Lisa Laporte,(248) 223-8937,4141
"Don Coleman Advertising, Inc. d/b/a GlobalHue123 William Street, Suite 1700New York, NY 10038",Advertising agency,New York | WIB Name: NEW YORK CITY| Region: New York City,-----,61,6/2/2013,Will occur between 8/30/2013 and 9/13/2013,-----,Possible Contract Loss,Potential Plant Layoff,Potential Plant Layoff,Employees do not have bumping rights and there is no bargaining unit involved.,Lisa Laporte,(248) 223-8937,4140
"ProHealth Care Associates, LLP1061 N. BroadwayN. Massapequa, NY 11758",Medical health management services,Oyster Bay | WIB Name: OYSTER BAY| Region: Long Island,7,7,5/31/2013,-----,8/31/2013,Private ownership,Plant Closing,Plant Closing,No bumping rights exist.,"Gina Schroeter, Vice President of Human Resources",(516) 622-6056,4139
"ProHealth Corp.1061 N. BroadwayN. Massapequa, NY 11758",Medical health management services,Oyster Bay | WIB Name: OYSTER BAY | Region: Long Island,17,17,5/31/2013,-----,8/31/2013,Private Ownership,Plant Closing,Plant Closing,No bumping rights exist.,"Gina Schroeter, Vice President of Human Resources",(516) 622-6056,4138
"Petri Baking Products, Inc.18 Main StreetSilver Creek, NY 14136",Bakery and Bakery Products,Chautauqua | WIB Name: CHAUTAUQUA| Region: Western Region,143,143,1/3/2013Amended 5/30/2013,"Layoffs will commence on June 15, 2013.",To occur between 6/15/13 and 6/28/13,Economic,Plant Closing,Plant Closing,The employees are not represented by a union.,"Alice Clark, Vice President, Labor and Employee Relations",(314) 877-7189,4137
"Acme Bus Corporation/Baumann and Sons Buses, Inc. 351-4 Old Riverhead RoadWesthampton, NY 11977",Bus transportation services for the Suffolk County Pre-K Program.,Suffolk | WIB Name: SUFFOLK| Region: Long Island,70,70,3/22/2013Amended 5/30/2013,-----,6/30/2013,Contract loss with the Suffolk County Pre-K Program to provide bus transportation services.,Possible Plant Closing,Plant Closing,IBT Local 1205,"James J. Poisella, Jr., Director of Human Resources","(631) 471-4600, extension #111",4136
"American Medical Response930 Flushing AvenueBrooklyn, NY 11206",Medical transport service,Kings | WIB Name: NEW YORK CITY| Region: New York CitySuffolk | WIB Name: SUFFOLK| Region: Long Island,119,119,5/30/2013,-----,7/1/2013,Economic,Plant Closing,Plant Closing,No bumping or transfer rights exist.,"Tara Ricketts, Director of Human Resources",(812) 421-6500,4135
"MHN Services420 Lexington Avenue Suite 2903New York, NY 10005",Health Plan Administrators,New York | WIB Name: NEW YORK CITY| Region: New York City,27,27,5/29/2013,-----,9/6/2013,Economic,Plant Closing,Plant Closing,-----,"Celina Dalton, Director, Organization Effectivenes",(818) 676-7232,4134
"Citizens Telecommunications Company of New York, Inc. aka Frontier TelephoneJohnstown Network Operating Center137 Harrison StreetGloversville, NY 12078",Telecommunications Provider,Fulton | WIB Name: FMS| Region: Mohawk Valley Region,160,27,5/22/2013Amended 5/29/2013,Layoffs to occur between 8/23/2013 and 11/15/2013,-----,"Consolidation of Operating Centers to Allen, TX",Plant Unit Closing,Plant Unit Closing,International Brotherhood of Electrical Workers (IBEW) Local Union 363,"Joyce Robbins, Senior Human Resources Manager",(518) 773-6239,4133
"Pearson Education, Inc.10 Bank StreetWhite Plains, NY 10606",Printing and Publishing,Westchester | WIB Name: WESTCHESTER| Region: Mid-Hudson Region,-----,55,5/28/2013,First separation is expected to occur on 8/22/2013 and should be completed within a 14-day period,-----,Economic,Plant Layoff,Plant Layoff,-----,"Diana Barrera Torre, People Director",(914) 287-8115,4132
"New York Hilton Midtown Room Service Department Only1335 Avenue of the AmericasNew York, NY 10019",Hotel Room Service Department only,New York | WIB Name: NEW YORK CITY| Region: New York City,55,55,5/28/2013,-----,8/20/2013,Economic,Plant Unit Closing,Plant Unit Closing,New York Hotel & Motel Trades Council AFL-CIO,"George Dertouzos, Human Resources",(212) 261-5784,4131
"Direct Access Partners, LLC40 Wall Street, 42nd and 43rd FloorsNew York, NY 10005",Financial Services,New York | WIB Name: NEW YORK CITY| Region: New York City,47,47,5/21/2013Amended 5/28/2013,5/20/2013 through closing date of 5/31/2013,5/31/2013,Economic,Plant Closing,Plant Closing,No bumping rights exist.,"Wael Sobby, Chief Administrative Officer",(212) 812-2057,4130
"Direct Access Partners, LLC40 Wall Street, 42nd and 43rd FloorsNew York, NY 10005",Financial Services,New York | WIB Name: NEW YORK CITY| Region: New York City,62 (at both locations),62 (at both locations),5/21/2013,5/20/2013 through closing date of 5/31/2013,5/31/2013,Economic,Plant Closing,Plant Closing,No bumping rights exist.,"Wael Sobby, Chief Administrative Officer",(212) 812-2057,4128
