"Kaye Scholer LLP425 Park AvenueNew York, NY 10022",Law firm,New York | WIB Name: NEW YORK CITY| Region: New York City,total number yet to be confirmed,6,6/20/2013 Amended 9/5/2013,Between 9/3/2013 and 10/3/2013,7/31/2014,"Relocation of Administrative/Support staff to Tallahassee, Florida",Plant Unit Closing,Plant Unit Closing,None of the affected employees are members of a labor organization.,"Dana Morgan, Human Resources Manager",(212) 836-8330,4269
"Keywell, L.L.C.300 Falconer StreetFrewsburg, NY 14738",Aerospace Metals and Specialty Steels recycling,Chautauqua | WIB Name: CHAUTAUQUA | Region: Western Region,83,83,8/30/2013 Amended: 9/4/2013,Terminations will take place 9/6/2013 through 9/19/2013 and 10/11/2013 through 10/24/2013.,10/24/2013,Economic,Plant Closing,Plant Closing,"United Steel, Paper and Forestry, Rubber, Manufacturing, Energy, Allied Industrial and Service Workers International Union, AFL-CIO, CLC, on behalf of USW Local 9367.","Jack Joyce, Vice President - HR",(773) 660-2060 ext. 235,4267
"Zip-Pak171 Route 303Orangeburg, NY 10962",Resealable packaging for packaged goods,Rockland | WIB Name: ROCKLAND | Region: Mid-Hudson Region,41,41,8/28/2013Amended 9/3/2013,Separations anticipated to occur between 12/6/2013 and 5/30/14,6/1/2014,Corporate reorganization,Plant Closing,Plant Closing,There are no bumping rights.,"Stephen Schaller, Director of Operations",(815) 341-0922,4266
"Keywell, L.L.C.300 Falconer StreetFrewsburg, NY 14738",Aerospace Metals and Specialty Steels recycling,Chautauqua | WIB Name: CHAUTAUQUA | Region: Western Region,49,49,8/30/2013,Terminations will take place 9/6/2013 through 9/19/2013 and 10/11/2013 through 10/24/2013.,10/24/2013,Economic,Plant Closing,Plant Closing,"United Steel, Paper and Forestry, Rubber, Manufacturing, Energy, Allied Industrial and Service Workers International Union, AFL-CIO, CLC, on behalf of USW Local 9367.","Jack Joyce, Vice President - HR",(773) 660-2060 ext. 235,4264
"Sodexo, Inc.100 James E Casey DriveBuffalo, NY 14206",Food Service,Erie | WIB Name: ERIE | Region: Western Region,41,41,8/30/2013,-----,11/29/2013,Loss of Contract,Plant Closing,Plant Closing,Rochester Regional Joint Board Workers United - Local 4,"Mahlet Tesfatsion, Sr. HR Manager",(646) 957-3290,4263
"Zip-Pak171 Route 303Orangeburg, NY 10962",Resealable packaging for packaged goods,Rockland | WIB Name: ROCKLAND | Region: Mid-Hudson Region,41,41,8/28/2013,Separations anticipated to occur between 12/6/2013 and 5/30/14,To be determined,Corporate reorganization,Plant Closing,Plant Closing,There are no bumping rights.,"Stephen Schaller, Director of Operations",(815) 341-0922,4262
"Capital One Bank151 Rodeo DriveBrentwood, NY 11717",Bank,Suffolk | WIB Name: SUFFOLK | Region: Long Island,23,23,5/16/2013Amended 8/29/2013,12/1/2013,12/1/2013,Economic,Plant Closing,Plant Closing,Employees are not represented by a union and they will not have bumping rights.,"Gail S. Ball, Vice President, Treasury Management Operations",(302) 494-7525,4261
"Bayer HealthCare LLC555 White Plains RoadTarrytown, NY 10591",Health Care and Medical Products Industry,Westchester | WIB Name: WESTCHESTER | Region: Mid-Hudson Region,175 Transfer opportunities have been offered to all workers. It is unknown how many will take advantage of the option to transfer at this time.,17,8/22/2013  Amended 8/28/2013,Will begin on 11/21/2013 or the 14-day period thereafter through 9/30/2014,9/30/2013,"Consolidation of business operations to Whippany, NJ",Plant Closing,Plant Closing,Bumping rights do not exist.,"Debbie Barchella, Senior HR Manager",(914) 333-6069,4260
"Lenroc, L.P. at the Holiday Inn Hotel222 S. Cayuga StreetIthaca, NY 14850",Hotel,Tompkins | WIB Name: TOMPKINS | Region: Southern Region,95,95,8/26/2013,11/22/2013,11/2/2013,Renovations to Hotel,Temporary Plant Closing,Temporary Plant Closing,Bumping rights do not exist for the affected employees as they are all non-union.,Mark Frantz,(716) 893-6551,4259
"Interfaith Medical Center1545 Atlantic AvenueBrooklyn, NY 11213",Medical Center,Kings | WIB Name: NEW YORK CITY | Region: New York City,1405,1405,8/2/2013 Amended: 8/23/2013,"Layoffs originally scheduled to commence on August 12, 2013, are now expected to commence on August 30, 2013, or within 14 days thereafter.",Undetermined at this time,Funding cuts,Plant Closing,Plant Closing,"1199 SEIU United Healthcare Workers East, New York State Nurses Association, NYSNA, The Committee of Residents and Interns/SEIU, New York State Federation of Physicians and Dentists, AFL-CIO","M. Denise McLellan, SPHR, CEBS, Director of Human Resources",(718) 613-6560,4258
"Bayer HealthCare LLC555 White Plains RoadTarrytown, NY 10591",Health Care and Medical Products Industry,Westchester | WIB Name: WESTCHESTER | Region: Mid-Hudson Region,-----,17,8/22/2013,Will being on 11/21/2013 or the 14-day period thereafter through 9/30/2014,Unspecified at this time,Economic,Plant Closing,Plant Closing,Bumping rights do not exist.,"Debbie Barchella, Senior HR Manager",(914) 333-6069,4257
"Personal Communication Devices, LLC80 Arkay Drive, Suite #210 (Corporate Office)Hauppauge, NY 11788",Wireless communication services,Suffolk | WIB Name: SUFFOLK | Region: Long Island,78,78,8/22/2013,-----,10/18/2013,Economic,Plant Closing,Plant Closing,Bumping rights do not exist and no labor unions represent any of the affected employees.,"Raymond F. Kunzmann, Chief Financial Officer",(631) 233-3347,4256
"Bombardier Mass Transit Corporation-Overhaul Division7940 State Route 415Bath, NY 14810",Rail equipment manufacturing,Steuben | WIB Name: CSS | Region: Southern Region,-----,11,8/22/2013,11/22/2013,-----,Economic,Plant Layoff,Plant Layoff,There is no employee representative.,"Tim Bunda, Human Resources",(215) 441-1863,4255
"Southeastern Container, Inc.115 Airport DriveWappingers Falls, NY 12590",Beverage Bottling Manufacturing,Dutchess | WIB Name: DUTCHESS | Region: Mid-Hudson Region,-----,31,6/20/2013Amended 8/21/2013,Some layoffs have been postponed to occur between 10/16/2013 and 11/12/2013.,9/21/2013,Economic,Plant Closing,Plant Closing,No bumping rights available and no union representation.,"Joaquin Gonzales, General Manager",(845) 463-3935 x 8203,4254
"Circor Flow Technologies Spence Engineering Company150 Coldenham RoadWalden, NY 12586",Manufacturer of steam specialty & fluid control devices,Orange | WIB Name: ORANGE | Region: Mid-Hudson Region,55,55,8/19/2013,To occur between 10/31/2013 and plant closing on 2/28/2014,2/28/2014,Economic,Plant Closing,Plant Closing,International Association of Machinist and Aerospace Workers Union (IAM),Sharon Bruel,(845) 778-6832,4253
"Xerox Business Services @ Xerox Federal Government Solutions501 Bleeker StreetUtica, NY 13501",Administrative support staff involved in Federal Student Loans,Oneida | WIB Name: HMO | Region: Mohawk Valley Region,-----,13,8/19/2013,11/22/2013,12/31/2013,Loss of Service Contract,Plant Unit Closing,Plant Unit Closing,-----,"Diane L. Wright, SPHR",(315) 738-2359,4252
"Northrop Grumman Systems CorporationElectronic Attack Center of Excellence600 Grumman Road WestBethpage, NY 11714",Aircraft Design,Nassau | WIB Name: OYSTER BAY | Region: Long Island,"1,333",143,8/14/2013 Amended: 8/20/2013,11/12/2013,-----,Transition of certain programs from Bethpage to other Centers of Excellence.,Plant Layoff,Plant Layoff,The affected workers do not have “bumping” rights and are not represented by a union.,"Amanda Sorensen, Director, Human Resources",(310) 813-0949,4251
"Northrop Grumman Systems CorporationElectronic Attack Center of Excellence600 Grumman Road WestBethpage, NY 11714",Aircraft Design,Nassau | WIB Name: OYSTER BAY | Region: Long Island,-----,143,8/14/2013,11/12/2013,-----,Transition of certain programs from Bethpage to other Centers of Excellence.,Plant Layoff,Plant Layoff,The affected workers do not have “bumping” rights and are not represented by a union.,"Amanda Sorensen, Director, Human Resources",(310) 813-0949,4250
"Landauer Metropolitan, Inc. One Bradford RoadMt. Vernon, NY",Medical equipment supplies and services provider,Westchester | WIB Name: WESTCHESTER | Region: Mid-Hudson RegionOyster Bay | WIB Name: OYSTER BAY | Region: Long IslandDutchess | WIB Name: DUTCHESS | Region: Mid-Hudson RegionMonroe | WIB Name: MONROE | Region: Finger Lakes RegionAlbany | WIB Name: CAPITAL DISTRICT | Region: Capital RegionErie | WIB Name: ERIE | Region: Western Region,198,198,8/13/2013 Amended 8/16/2013,-----,10/8/2013,Potential Sale of Business to Quadrant Management Inc.,Plant Closing,,Company is not unionized and no bumping rights exist.,"Stephanie Ranellone, Human Resources Manager",(914) 663-3421,4249
"Sodexo, Inc.Empire State PlazaAlbany, NY 12220",Food Service,Albany | WIB Name: CAPITAL DISTRICT | Region: Capital Region,128,128,8/8/2013Amended 8/15/2013,-----,11/3/2013,Contract Loss,Plant Closing,Plant Closing,Local 471 Rochester Regional Joint Board,"Nancy Hellner, Vice President of Operations",(856) 298-8326,4248
"Archcare, Inc. @ Kateri Residence150 Riverside DriveNew York, NY 10024",Skilled Nursing Facility,New York | WIB Name: NEW YORK CITY| Region: New York City,555,555,12/3/2012Amended 8/14/2013,-----,Sale has been postponed to occur on or about 8/28/2013,Sale of facility,Plant Closing,Plant Closing,1199 SEIU,"Hugo A. Pizarro, Vice President, Human Resources",(646) 633-4422,4247
"Landauer Metropolitan, Inc. One Bradford RoadMt. Vernon, NY",Medical equipment supplies and services provider,Westchester | WIB Name: WESTCHESTER | Region: Mid-Hudson RegionOyster Bay | WIB Name: OYSTER BAY | Region: Long IslandDutchess | WIB Name: DUTCHESS | Region: Mid-Hudson RegionMonroe | WIB Name: MONROE | Region: Finger Lakes RegionAlbany | WIB Name: CAPITAL DISTRICT | Region: Capital RegionErie | WIB Name: ERIE | Region: Western Region,296 in all locations indicated,296,8/13/2013,-----,10/8/2013,Potential Sale of Business to Quadrant Management Inc.,Plant Closing,Plant Closing,Company is not unionized and no bumping rights exist.,"Stephanie Ranellone, Human Resources Manager",(914) 663-3421,4246
"JPMorgan Chase & Co. Mortgage Banking Productions Operations Unit Chase Homeownership Center4 Chase MetroTech CenterBrooklyn, NY 11245",Mortgage Banking Production Operations Unit & Quality Assurance,New York | WIB Name: NEW YORK CITY | Region: New York City,10,19 – 10 from the Productions Operations Unit (closing) / 9 from Quality Assurance (not closing),8/9/2013 Amended 8/14/2013,11/10/2013,11/10/2013,Economic,Plant Unit Closing,Plant Unit Closing,Non-union,Magaly Denis-Roman,(201) 595-5230,4245
"Bombardier Mass Transit Corporation-Overhaul Division7940 State Route 415Bath, NY 14810",Rail equipment manufacturing,Steuben | WIB Name: CSS | Region: Southern Region,-----,10,8/13/2013,11/15/2013,-----,Economic,Plant Layoff,Plant Layoff,There is no employee representative.,"Tim Bunda, Human Resources",(215) 441-1863,4244
"BorgWarner Morse TEC/Powerdered Metal Operation (PMO)3690 Luker RoadCortland, NY 13045",Automobile parts manufacturing & testing,Cortland | WIB Name: CAYUGA/CORT | Region: Central RegionCounty: Tompkins | WIB Name: TOMPKINS | Region: Southern Region,-----,25,1/18/2013 Amended: 8/13/2013,Layoffs will occur between 5/10/2013 and 10/31/2013.,Production will cease on 6/14/2013 and plant closing will occur by 10/31/2013,Economic,Plant Closing,Plant Closing,Teamsters Local 317,"Michael Rubino, Senior Manager, Human Resources and Labor Relations",(607) 266-5247,4243
"G4S Government Solutions, Inc.26 Federal Plaza, Room 2-130New York, NY 10278",Security services,New York | WIB Name: NEW YORK CITY | Region: New York City,255,255 (total affected for all 33 sites),8/6/2013  Amended: 8/13/13,-----,9/30/2013,Contract Expiration,Plant Closing,Plant Closing,-----,"Paul Cottle, Manager Human Resources Compliance",(800) 325-5432,4242
"JPMorgan Chase & Co. Mortgage Banking Productions Operations Unit Chase Homeownership Center4 Chase MetroTech CenterBrooklyn, NY 11245",Mortgage Banking Production Operations Unit,New York | WIB Name: NEW YORK CITY | Region: New York City,-----,19,8/9/2013,First terminations to occur on 11/10/2013,to be determined,Economic,Plant Unit Closing,Plant Unit Closing,Non-union,Magaly Denis-Roman,(201) 595-5230,4241
"SUNY Downstate Medical Center at LICH - StaffCo.339 Hicks StreetBrooklyn, NY 11201",Medical Center,Kings | WIB Name: NEW YORK CITY| Region: New York City,1666,1666,3/25/2013Amended 8/12/2013,Layoffs are postponed to occur between 8/28/2013 and 9/10/2013,postponed to occur between 8/28/2013 and 9/10/2013,Economic,Plant Closing,Plant Closing,"1199 SEIU United Healthcare Workers East, New York State Nurses Association","Francesca Tinti, Assistant Vice President for Human Resources",(718) 780-1500,4240
"Philips Lighting Company7265 Route 54Bath, NY",Manufacturing outdoor//indoor lighting products,Steuben | WIB Name: CSS| Region: Southern Region,268,268,12/6/2012Amended 8/12/2013,Postponed to occur on or about March 2014,March 2014,Economic,Plant Closing,Plant Closing,USWA,"Amy Heysham, Human Resources Manager",(607) 776-8217,4239
"Citigroup Inc.188 King StreetArmonk, NY 10504",Financial,Westchester | WIB Name: WESTCHESTER | Region: Mid-Hudson Region,-----,36,8/9/2013,11/7/2013,-----,Economic,Plant Layoff,Plant Layoff,There are no bumping rights applicable and no union represents these employees.,"Jill Rorschach, Director of Employee Relations for Citi",(469) 220-4363,4237
"G4S Government Solutions, Inc.26 Federal Plaza, Room 2-130New York, NY 10278",Security services,New York | WIB Name: NEW YORK CITY| Region: New York City,255,255,8/6/2013,-----,9/30/2013,Contract Expiration,Plant Closing,Plant Closing,-----,"Paul Cottle, Manager Human Resources Compliance",(800) 325-5432,4236
"Bausch & Lomb Inc./Valeant PharmaceuticalsOne Bausch and & Lomb PlaceRochester, NY 14604",Optical Instrument & Lens Manufacturing including Headquarters and R&D Management/Administrative/Scientific,Monroe | WIB Name: MONROE| Region: Finger Lakes Region,-----,106,8/7/2013,Layoffs will commence on 11/3/2013 and run through a to-be-determined date in 2014,-----,Company acquisition,Plant Layoff,Plant Layoff,Employees do not belong to a bargaining unit nor do they possess bumping rights.,"Kelly Webber, Vice President, Human Resources, Valeant Pharmaceuticals",(908) 927-1710,4235
"Sodexo, Inc.Empire State PlazaAlbany, NY 12220",Food Service,Albany | WIB Name: CAPITAL DISTRICT| Region: Capital Region,128,128,8/8/2013,-----,11/3/2013,Union Contract Negotiations,Potential Plant Closing,Potential Plant Closing,Local 471 Rochester Regional Joint Board,"Nancy Hellner, Vice President of Operations",(856) 298-8326,4234
"Interfaith Medical Center1545 Atlantic AvenueBrooklyn, NY 11213",Medical Center,Kings | WIB Name: NEW YORK CITY | Region: New York City,1405,1405,8/2/2013Amended 8/8/2013,anticipated to begin 8/12/2013 or within 14 days thereafter,Undetermined at this time,Funding cuts,Plant Closing,Plant Closing,"1199 SEIU United Healthcare Workers East, New York State Nurses Association, NYSNA, The Committee of Residents and Interns/SEIU, New York State Federation of Physicians and Dentists, AFL-CIO","M. Denise McLellan, SPHR, CEBS, Director of Human Resources",(718) 613-6560,4233
"QPH Inc. d/b/a Holliswood Hospital87-37 Palermo StreetHolliswood, NY 11423",Hospital,Queens | WIB Name: NEW YORK CITY| Region: New York City,-----,376,8/6/2013,During the 14-day period beginning on 8/12/2013 through closing,undetermined at this time,Economic,Plant Closing,Plant Closing,1199 SEIU United Healthcare Workers East,"Dorothy Muller, Director of Human Resources",(718) 776-8181 Ext 2337,4232
"Sound Shore Health System Inc.Sound Shore Health Medical Center of Westchester16 Guion PlaceNew Rochelle, NY 10802",Medical services,Westchester | WIB Name: WESTCHESTER| Region: Mid-Hudson Region,1197,1197,7/24/2013Amended 8/7/2013,Between 10/23/2013 and 11/5/2013,11/5/2013,Sale of Assets,Plant Closing,Plant Closing,"NYSNA, 1199 SEIU, TEAMSTERS, Local Union 445","Dennis Ashley, Senior Vice President, Human Resources",(914) 365-4802,4231
"Bombardier Mass Transit Corporation-Overhaul Division7940 State Route 415Bath, NY 14810",Rail equipment manufacturing,Steuben | WIB Name: CSS| Region: Southern Region,-----,3,8/7/2013,11/8/2013,-----,Economic,Plant Layoff,Plant Layoff,There is no employee representative.,"Tim Bunda, Human Resources",(215) 441-1863,4230
"Interfaith Medical Center1545 Atlantic AvenueBrooklyn, NY 11213",Medical Center,Kings | WIB Name: NEW YORK CITY | Region: New York City,1543 - for all 7 locations listed,1543,8/2/2013,8/12/2013 or within 14 days thereafter,8/12/2013,Funding cuts,Plant Closing,Plant Closing,"1199 SEIU United Healthcare Workers East, New York State Nurses Association, NYSNA, The Committee of Residents and Interns/SEIU","M. Denise McLellan, SPHR, CEBS, Director of Human Resources",(718) 613-6560,4228
"Archcare, Inc. @ Kateri Residence150 Riverside DriveNew York, NY 10024",Skilled Nursing Facility,New York | WIB Name: NEW YORK CITY| Region: New York City,555,555,12/3/2012Amended 8/1/2013,-----,Sale has been postponed to occur on or about 8/9/2013,Sale of facility,Plant Closing,Plant Closing,1199 SEIU,"Hugo A. Pizarro, Vice President, Human Resources",(646) 633-4422,4227
"Bombardier Mass Transit Corporation-Overhaul Division7940 State Route 415Bath, NY 14810",Rail equipment manufacturing,Steuben | WIB Name: CSS| Region: Southern Region,-----,7,7/31/2013,11/1/2013,-----,Economic,Plant Layoff,Plant Layoff,There is no employee representative.,"Tim Bunda, Human Resources",(215) 441-1863,4226
"Central Laundry Service Corp.46 Crown StreetBrooklyn, NY 11225",Linen supply,Kings | WIB Name: NEW YORK CITY| Region: New York City,207,207,7/12/2013Amended 7/31/2013,-----,on or about 10/16/2013,Economic,Plant Closing,Plant Closing,Laundry Distribution and Food,Stanley Olan,(718) 287-4800,4225
"AmeriGas Propane, Inc.271 Merritt AvenueWyandanch, NY 11798",Propane,Suffolk | WIB Name: SUFFOLK | Region: Long Island,14,14,7/26/2013,Will occur between 8/1/2013 and 8/14/2013,8/14/2013,Economic,Plant Closing,Plant Closing,Local 282 International Brotherhood of Teamsters,"Troy Fee, Vice President, Human Resources",(610) 768-3688,4224
"St. Vincent's Services-Close to Home Program12 Steuben PlaceStaten Island, NY 10304",Children's Services,Richmond | WIB Name: NEW YORK CITY | Region: New York City,37 - all employees work interchangably at both site locations,37,7/26/2013,9/1/2013,9/1/2013,Economic,Plant Closing,Plant Closing,There are no bumping rights for employees.,"Mark S. Kanter, Managing Director of Human Resources",(718) 422-2240,4223
"Abigail KirshII, LLC d/b/a Abigail Kirsch The New York Botanical Garden 200th Street and Southern BoulevardBronx, NY 10458",Visitor Center and Garden Café,Bronx | WIB Name: NEW YORK CITY | Region: New York City,37,37,7/25/2013,-----,10/25/2013,Economic,Plant Closing,Plant Closing,There are no bumping rights and affected employees are not represented by any union.,"Luisa Marciano, Corporate Director of Human Resources",(914) 269-9645,4222
,Medical services,Westchester | WIB Name: WESTCHESTER| Region: Mid-Hudson Region,1993 in all locations listed,1993,7/24/2013,Between 10/23/2013 and 11/5/2013,11/5/2013,Sale of Assets,Plant Closing,Plant Closing,"NYSNA, 1199 SEIU, TEAMSTERS, Local Union 445","Dennis Ashley, Senior Vice President, Human Resources",(914) 365-4802,4221
,School Transportation-Suffolk County School District,Suffolk | WIB Name: SUFFOLK| Region: Long Island,330at both site locations listed below,330,7/19/2013Amended 7/25/2013,-----,6/21/2013,Sale of contracts,Plant Closing,Plant Closing,"United Service Workers Union, IUJAT","Diane Turcotte, Human Resources",(718) 556-8082,4219
"Eastman Kodak Company (Eastman Park)1669 Lake AvenueRochester, NY 14650",Photographic equipment and supplies,Monroe | WIB Name: MONROE| Region: Finger Lakes Region,-----,7 total – 3 on site and 4 working in NY off site,7/24/2013,9/15/2013 on site employees & 9/24/2013 off site employees,-----,Economic,Plant Layoff,Plant Layoff,Bumping rights do exist.,"Mary C. Lazzar-Whyte, Director, HR Americas Employee Services",(585) 781-1896,4218
"Bendiner & Schlesinger, Inc. Medical Laboratories Headquarters140 58th Street, Brooklyn Army Terminal, Bldg B, Unit 8DBrooklyn, NY 11220",Medical Laboratories,Kings/Bronx/Richmond | WIB Name: NEW YORK CITY| Region: New York CityWestchester | WIB Name: WESTCHESTER| Region: Mid-Hudson Region,238,238,2/19/2013Amended 7/23/2013,Some layoffs will be postponed to occur between 7/16/2013 and 9/30/2013,approximately 5/15/2013,Sale of company's assets,Plant Closing,Plant Closing,1199SEIU,"Peter Stein, Executive Vice President",(212) 254- 2300 Ext 5132,4217
"Acme Bus Corp.21 Fulton StreetMiddletown, NY 10940",Provides transportation to the special needs pre-school children's program.,Orange | WIB Name: ORANGE | Region: Mid-Hudson Region,164,164,3/18/2013Amended 7/23/2013Control Number: 2012-0216,Layoffs are expected to occur on 8/16/2013 or during the fourteen day period commencing on that date.,8/16/2013,Contract Expiration with the Orange County Department of Health effective 8/16/2013.,Plant Closing,Plant Closing,There are no bumping rights for the affected workers.,"James J. Poisella, Jr., Director of Human Resources","(631) 471-4600, Extension #111",4216
"Bombardier Mass Transit Corporation-Overhaul Division7940 State Route 415Bath, NY 14810",Rail equipment manufacturing,Steuben | WIB Name: CSS| Region: Southern Region,-----,8,7/23/2013,10/25/2013,-----,Economic,Plant Layoff,Plant Layoff,There is no employee representative.,"Tim Bunda, Human Resources",(215) 441-1863,4215
"Atlantic Express Transportation Corp./Amboy Bus Company Inc.7 North StreetStaten Island, NY 10302",School Transportation-Suffolk County School District,New York | WIB Name: NEW YORK CITY| Region: New York City,330,330,7/19/2013,-----,6/21/2013,Sale of contracts,Plant Closing,Plant Closing,"United Service Workers Union, IUJAT","Diane Turcotte, Human Resources",(718) 556-8082,4214
"Xerox Business Services @ Xerox Federal Government Solutions501 Bleeker StreetUtica, NY 13501",Administrative support staff involved in Federal Student Loans,Oneida | WIB Name: HMO| Region: Mohawk Valley Region,-----,42,7/22/2013,10/25/2013,12/31/2013,Loss of Service Contract,Plant Unit Closing,Plant Unit Closing,-----,"Diane L. Wright, SPHR",(315) 738-2359,4213
"American Customer Care150 N Main Street, 3rd FloorElmira, NY 14901",Outsourced Contact Center Services,Chemung | WIB Name: CSS | Region: Southern Region,43,43,7/19/2013,-----,on or about 10/18/2013,Economic,Plant Closing,Plant Closing,There are no bumping rights and affected employees are not represented by a union.,"Ely Merrell, Human Resources Director",(860) 584-4428,4211
"BorgWarner Morse TEC/Powerdered Metal Operation (PMO)3690 Luker RoadCortland, NY 13045",Automobile parts manufacturing & testing,Cortland | WIB Name: CAYUGA/CORT | Region: Central RegionCounty: Tompkins | WIB Name: TOMPKINS | Region: Southern Region,-----,25,1/18/2013 Amended: 7/18/2013,Layoffs will occur between 5/10/2013 and 10/31/2013.,Production will cease on 6/14/2013 and plant closing will occur by10/31/2013,Economic,Plant Closing,Plant Closing,Teamsters Local 317,"Michael Rubino, Senior Manager, Human Resources and Labor Relations",(607) 266-5247,4210
"Knight Capital Americas LLC320 Park AvenueNew York, NY 10022",Broker/Dealer for equity securities,New York | WIB Name: NEW YORK CITY | Region: New York City,-----,22,6/12/2013   Amended 7/16/2013,Separations occurred between 3/28/2013 and 8/13/2013,-----,Economic,Plant Layoff,Plant Layoff,No bumping rights exist.,"Bronwen Bastone, Senior Managing Director – Human Resources",(201) 557-6861,4209
"ROC/United Airlines1200 Brooks Avenue, Greater Rochester International AirportRochester, NY 14624",United Airlines Airport Operations Division-customer service and ramp operations,Monroe | WIB Name: MONROE | Region: Finger Lakes Region,-----,40,7/12/2013,on 10/15/2013 or during the 14-day period thereafter,-----,To be provided by an outside vendor,Plant Layoff,Plant Unit Closing,International Association of Machinists,Tom Reardon,(872) 825-2069,4208
"Rich's Products Corporation Manufacturing10 White StreetRochester, NY 14608",Bakery Product Manufacturing Facililty,Monroe | WIB Name: MONROE| Region: Finger Lakes Region,92,92,7/12/2013,-----,10/10/2013,Economic,Plant Closing,Plant Closing,-----,"Martha Rogers, Human Resources Manager",(716) 878-8609,4207
"Central Laundry Service Corp.46 Crown StreetBrooklyn, NY 11225",Linen supply,Kings | WIB Name: NEW YORK CITY| Region: New York City,207,207,7/12/2013,-----,on or about 9/11/2013,Economic,Plant Closing,Plant Closing,Laundry Distribution and Food,Stanley Olan,(718) 287-4800,4206
"Gleacher & Company Securities Inc.1290 Avenue of the AmericasNew York, NY 10104",Savings and Securities,New York | WIB Name: NEW YORK CITY| Region: New York City,-----,34,7/11/2013,6/4/2013,------,Economic,Plant Layoff,Plant Layoff,No union representation and no bumping rights exist.,"James Minogue, Chief Human Resources Officer",(212) 273-7160,4205
"Gleacher & Company Securities Inc.1290 Avenue of the AmericasNew York, NY 10104",Savings and Securities,New York | WIB Name: NEW YORK CITY| Region: New York City,-----,26,5/20/2013Amended 7/11/2013,Between 5/4/2013 and 5/24/2013,------,Economic,Plant Layoff,Plant Layoff,No union representation and no bumping rights exist.,"James Minogue, Chief Human Resources Officer",(212) 273-7160,4204
