"Citizens Telecommunications Company of New York, Inc. aka Frontier TelephoneJohnstown Network Operating Center137 Harrison StreetGloversville, NY 12078",Telecommunications Provider,Fulton | WIB Name: FMS| Region: Mohawk Valley Region,-----,27,5/22/2013,Layoffs to occur between 8/23/2013 and 11/15/2013,-----,Relocation of Operating Center,Plant Layoff,Plant Layoff,International Brotherhood of Electrical Workers (IBEW) Local Union 363,"Joyce Robbins, Senior Human Resources Manager",(518) 773-6239,4127
"Time Warner Cable109-15 14th AvenueCollege Point, NY 11356",Collections and retention,Queens | WIB Name: NEW YORK CITY | Region: New York City,-----,75,5/21/2013,8/19/2013,-----,Economic,Plant Layoff,Plant Layoff,"No union representation and no provision for transfer, bumping or reassignment.","Connie Ciliberti, Vice President, Human Resources-NNY & Northeast",(212) 420-5503,4126
"BorgWarner Morse TEC/Powerdered Metal Operation (PMO)3690 Luker RoadCortland, NY 13045",Automobile parts manufacturing & testing,Cortland | WIB Name: CAYUGA/CORT| Region: Central RegionCounty: Tompkins / WIB Name: TOMPKINS /Region: Southern Region,-----,25,1/18/2013 Amended: 5/20/2013,Layoffs will occur between 5/10/2013 and 10/31/2013.,Production will cease on 6/14/2013,Economic,Plant Closing,Plant Closing,Teamsters Local 317,"Michael Rubino, Senior Manager, Human Resources and Labor Relations",(607) 266-5247,4125
"Artio Global Investors330 Madison AvenueNew York, NY 10017(acquired by Aberdeen Asset Management PLC)",Investment Manager,New York | WIB Name: NEW YORK CITY| Region: New York City,120,94,5/20/2013,"Layoffs will occur between 5/21/2013 and December 31, 2013. 26 will remain with Aberdeen Asset Management PLC",5/21/2013,Aberdeen Asset Management PLC acquisition of Artio Global Investors 5/22/2013,Plant Closing,Plant Closing,"None of Artio Global Management, LLC’s employees are unionized.","Debbie Cooper, Head of Human Resources, Artio Global Management LLC Marika Tooze, Head of Human Resources – Americas, Aberdeen Asset Managment",Ms. Cooper (215) 297-3725/ Ms. Tooze (215) 405-5615,4124
"Gleacher & Company Securities Inc.1290 Avenue of the AmericasNew York, NY 10104",Savings and Securities,New York | WIB Name: NEW YORK CITY | Region: New York City,-----,33,5/20/2013,Between 5/4//2013 and 5/24/2013,------,Economic,Plant Layoff,Plant Layoff,No union representation and no bumping rights exist.,"James Minogue, Chief Human Resources Officer",(212) 273-7160,4122
,Phamaceutical distribution,Nassau | WIB Name: OYSTER BAY | Region: Long Island,96,96,5/14/2013 Amended 5/20/2013,-----,5/13/2013,Economic,Plant Closing,Plant Closing,No bumping rights exist and the employees are not represented by any union.,Collette Taylor,(224) 205-8550,4121
"The Carriage House Companies, Inc.26 East Talcott StreetDunkirk, NY 14048",Manufacturing sandwich spreads/drink mix products,Chautauqua | WIB Name: CHAUTAUQUA | Region: Western Region,133,"133 (118 production employees and 15 administrative employees). As of this amendment, 18 production employees and 5 administrative employees have been released. All other employees have been absored in the Fredonia operations.",1/3/2013Amended: 5/20/2013,Some layoffs are postponed to occur between 5/6/2013 or within 14 days thereafter.,Production ceased - 4/12/2013,Economic,Plant Unit Closing,Plant Unit Closing,"Chapter 266, National Conference Firemen & Oilers District of Local 32 BJ/S.E.I.U.","Alice Clark, Vice President Labor & Employee Relations",(314) 877-7189,4120
"Xerox Business Services @ Xerox Federal Government Solutions501 Bleeker StreetUtica, NY 13501",Administrative support staff involved in Federal Student Loans,Oneida | WIB Name: HMO | Region: Mohawk Valley Region,158,55,5/17/2013,second phase of closing - 8/30/2013,December 2013,Loss of Service Contract,Plant Unit Closing,Plant Unit Closing,-----,"Janelle R. Burns, SPHR, Sr. HR Consultant",(801) 567-5466,4118
"JOFAZ Transportation, Inc.1 Coffey StreetBrooklyn, NY 11231",Transportation,Kings | WIB Name: NEW YORK CITY| Region: New York City,111,111,5/17/2013,-----,8/17/2013,Loss of N.Y.C.DOE Contract,Plant Closing,Plant Closing,Local 854 IBT,"Lenny D'Amico, General Manager",(718) 852-0286,4117
"Capital One Bank151 Rodeo DriveBrentwood, NY 11717",Bank,Suffolk | WIB Name: SUFFOLK| Region: Long Island,26,26,5/16/2013,Separations are projected to occur during the fourth quarter of 2013,Closing expected to occur by 12/31/2013,Economic,Plant Closing,Plant Closing,Employees are not represented by a union and they will not have bumping rights.,"Gail S. Ball, Vice President, Treasury Management Operations",(302) 494-7525,4115
"NYSARC, Inc. Putnam County Chapter – PARC Program125 Baldwin Place RoadMahopac, NY 10541",Preschool Program,Putnam | WIB Name: WESTCH/PTNM| Region: Mid-Hudson Region,47,47,3/21/2013Notice Rescinded 5/16/2013,Layoffs will commence on 6/21/2013 and continue through 8/9/2013,8/9/2013,Economic,Plant Closing,Plant Closing,No bumping rights for employees.,"Diane Capizzuto, Chief HR Officer",(845) 278-7272 Ext 2480,4114
"Totsy, Inc.75 Broad Street, 15th FloorNew York, NY 10004",Children's clothing,New York | WIB Name: NEW YORK CITY| Region: New York City,83,83,5/16/2013,To occur between 5/15/2013 and 5/31/2013,5/31/2013,Economic,Plant Closing,Plant Closing,No bumping rights exist. No employees are represented by a union.,"Lisa Kennedy, Chief Executive Officer",(212) 729-0342,4113
"OSI Pharmaceuticals, LLC1 Bioscience Park DriveFarmingdale, NY 11735",Phamaceutical distribution,Nassau | WIB Name: OYSTER BAY| Region: Long Island,114,114,5/14/2013,-----,5/13/2013,Economic,Plant Closing,Plant Closing,No bumping rights exist and the employees are not represented by any union.,Collette Taylor,(224) 205-8550,4112
"Catherine McAuley High School710 East 37th StreetBrooklyn, NY 11203",School,Kings | WIB Name: NEW YORK CITY| Region: New York City,28,28,5/13/2013,-----,8/31/2013,Economic,Plant Closing,Plant Closing,There are no bumping rights at this location and the affected employees are not represented by any union.,"Sister Margaret Dempsey, RSM – President Catherine McAuley High School",(718) 462-7282 Ext 16,4111
"Credit Suisse Securities (USA) LLCOne Madison Avenue and Eleven Madison Avenue (one site)New York, NY 10010",Financial Institution,New York | WIB Name: NEW YORK CITY| Region: New York City,-----,83,5/13/2013,Will occur between 5/30/2013 and 8/4/2013,-----,Economic,Plant Layoff,Plant Layoff,No bumping rights exist.,"Ketty K. Russeva, Managing Director, Human Resources",(212) 538-8263,4110
,Publishing,New York | WIB Name: NEW YORK CITY | Region: New York City,----,27,4/30/2013 Amended 5/10/2013,Layoffs to occur between 7/30/2013 and 8/1/2015,------,"Acquisition by Shutterfly, Inc.",Plant Layoff,Plant Layoff,No bumping rights exist and none of the affected employees are represented by a union.,"Charlotte Falla, Vice President, Legal and General Counsel",(650) 610-5459,4109
"Bunzl New York300 Duffy AvenueHicksville, NY 11801",Warehouse and delivery operations,Oyster Bay | WIB Name: OYSTER BAY| Region: Long Island,52,30,5/3/2013Amended 5/7/2013,during a 14-day period beginning on 8/2/2013,8/16/2013,Consolidation into other existing facilities,Plant Unit Closing,Plant Unit Closing,Local 813 International Brotherhood of Teamsters,"Thomas Long, General Manager",(516) 937-7400,4107
"Green Chimneys-Gramercy Group Residence327 East 22nd StreetNew York, NY 10010",Residential facility for children,New York | WIB Name: NEW YORK CITY| Region: New York City,43,43,5/7/2013,-----,8/4/2013,Contract loss,Plant Closing,Plant Closing,Bumping rights do not exist and a union does not exist at these sites.,"Donna Kessler, Director of Human Resources",(845) 279-2995 X 140,4106
"Rochester Beer & Beverage Corp.16 Marway CircleRochester, NY 14624",Beverage Distribution,Monroe | WIB Name: MONROE| Region: Finger Lakes Region,63,63,5/6/2013,6/1/2013,Tentatively on 6/1/2013,Economic,Plant Closing,Plant Closing,Teamsters Local Union 118,"Adam Jablonski, President",(585) 426-0040,4105
"Post House Investors L.P.28 East 63rd StreetNew York, NY 10065",Restaurant,New York | WIB Name: NEW YORK CITY| Region: New York City,59,59,5/6/2013,,8/2/2013,Closed temporarily for renovations for a period of at least 6 months,Plant Closing,Plant Closing,UNITE HERE Local 100,Donald H. Brennan,(212) 687-3500,4104
"Lakeside Memorial Hospital -Emergency Department and Inpatient Unit155 West AvenueBrockport, NY 14420",Hospital,Monroe | WIB Name: MONROE| Region: Finger Lakes Region,343,343,2/22/2013Amended 5/6/2013,-----,4/29/2013 or thereabouts with some affected employees remaining on site to wind down operations,Economic,Plant Closing,Plant Closing,None of the affected employees are represented by a union and there is no employee representative.,"Jim Grunert, Administrative Director of Human Resources",(585) 395-6095 Ext 4493,4103
"Bunzl New York300 Duffy AvenueHicksville, NY 11801",Warehouse and delivery operations,Oyster Bay | WIB Name: OYSTER BAY | Region: Long Island,30,30,5/3/2013,during a 14-day period beginning on 8/2/2013,8/16/2013,Economic,Plant Unit Closing,Plant Unit Closing,Local 813 International Brotherhood of Teamsters,"Thomas Long, General Manager",(516) 937-7400,4101
"Tyco Integrated SecurityRochester National Dispatch Center265 Thruway Park DriveW. Henrietta, NY 14586",Security Systems Services,Monroe | WIB Name: MONROE| Region: Finger Lakes Region,132,132,5/2/2013,Layoffs will occur between 8/1/2013 and 10/31/2013,10/31/2013,Economic,Plant Closing,Plant Closing,No bumping rights exist and employees are not represented by a union.,"JR Booth, Human Resources Manager",(585) 259-1211,4099
"Teva Pharmaceuticals USA, Inc.Manufacturing Operations223 Quaker RoadPomona, NY 10970",Pharmaceuticals production,Rockland | WIB Name: ROCKLAND| Region: Mid-Hudson Region,,2,5/2/2013,"April 26, 2013","It is expected that layoffs will commence on April 3, 2013 and will be completed within two years. Reason for Dislocation: Transfer Manufacturing Operations to another site.",,Plant Unit Closing,Plant Unit Closing,"United Steel, Paper and Forestry Rubber, Manufacturing Energy, Allied Industrial and Service Workers International Union, District 4.","Elaine A. Lakis, Associate Director, Human Resources",(845) 362-7056,4098
"MYPublisher, Inc.845 Third AvenueNew York, NY 10022",Publishing,New York | WIB Name: NEW YORK CITY| Region: New York City,34,34,4/30/2013,Layoffs to occur between 7/28/2013 and 1/31/2014,Acquisition closing date 4/29/2013,"Acquisition by Shutterfly, Inc.",Plant Closing,Plant Closing,No bumping rights exist and none of the affected employees are represented by a union.,"Charlotte Falla, Vice President, Legal and General Counsel",(650) 610-5459,4095
"Barclays Capital Inc.200 Park AvenueNew York, NY 10166",Investment banking,New York | WIB Name: NEW YORK CITY| Region: New York City,-----,1,4/29/2013,5/15/2013 and within the 14 day period following,-----,Economic,Plant Layoff,Plant Layoff,No bumping rights are applicable.,Allison Kramer Deeb,(212) 412-3157,4094
,Hospital,Monroe | WIB Name: MONROE | Region: Finger Lakes Region,368,368,2/22/2013  Amended 4/25/2013,-----,4/29/2013 or thereabouts with some affected employees remaining on site to wind down operations,Economic,Plant Closing,Plant Closing,None of the affected employees are represented by a union and there is no employee representative.,"Jim Grunert, Administrative Director of Human Resources",(585) 395-6095 Ext 4493,4092
"Archcare, Inc. @ Kateri Residence150 Riverside DriveNew York, NY 10024",Skilled Nursing Facility,New York | WIB Name: NEW YORK CITY| Region: New York City,592,592,12/3/2012Amended 4/24/2013,-----,Sale has been postponed to occur on 6/21/2013,Sale of facility,Plant Closing,Plant Closing,1199 SEIU,"Hugo A. Pizarro, Vice President, Human Resources",(646) 633-4422,4091
"Gleacher & Company Securities Inc.1290 Avenue of the AmericasNew York, NY 10104",Savings and Securities,New York | WIB Name: NEW YORK CITY| Region: New York City,-----,55,4/12/2013Amended 4/24/2013,4/11/2013,------,Economic,Plant Layoff,Plant Layoff,No union representation and no bumping rights exist.,Ms. Arciero-Craig,(212) 273-2305,4090
,Aluminum casting foundry,Onondaga | WIB Name: ONONDAGA | Region: Central Region,86,86,2/7/2013 Amended 4/23/2013,First separations to occur on 5/11/2013,Plant expected to close on or around 6/30/2013.,Economic,Plant Closing,Plant Closing,UAW,"Evan Beach, Chief Financial Officer",(315) 952-0138,4089
"Chartwells Dining Services c/o University at Albany1400 Washington AvenueAlbany, NY 12222",Dining Services,Albany | WIB Name: CAPITAL DISTRICT | Region: Capital Region,471,471,4/23/2013,Will commence on 4/25/2013 and occur in phases through end of contract on 6/30/2013,6/30/2013,Loss of Contract,Plant Closing,Plant Closing,Workers United,Rebecca Reed,(401) 714-2987,4087
"The Carriage House Companies, Inc.26 East Talcott StreetDunkirk, NY 14048",Manufacturing sandwich spreads,Chautauqua | WIB Name: CHAUTAUQUA| Region: Western Region,133,133,1/3/2012Amended: 4/23/2013,Some layoffs are postponed to occur between 5/6/2013 or within a 14-day following,Production ceased - 4/12/2013,Sale of Company,Plant Closing,Plant Closing,"Chapter 266, National Conference Firemen & Oilers District of Local 32 BJ/S.E.I.U.","Alice Clark, Vice President Labor & Employee Relations",(314) 877-7189,4086
"Gleacher & Company Securities Inc.1290 Avenue of the AmericasNew York, NY 10104",Savings and Securities,New York | WIB Name: NEW YORK CITY| Region: New York City,-----,55,4/12/2013Amended 4/23/2013,6/15/2013,------,Economic,Plant Layoff,Plant Layoff,No union representation and no bumping rights exist.,Ms. Arciero-Craig,(212) 273-2305,4085
"Gleacher & Company Securities Inc.1290 Avenue of the AmericasNew York, NY 10104",Savings and Securities,New York | WIB Name: NEW YORK CITY| Region: New York City,-----,19,4/22/2013Amended 4/23/2013,4/19/2013,------,Economic,Plant Layoff,Plant Layoff,No union representation and no bumping rights exist.,Ms. Arciero-Craig,(212) 273-7305,4084
"Petri Baking Products, Inc.18 Main StreetSilver Creek, NY 14136",Bakery and Bakery Products,Chautauqua | WIB Name: CHAUTAUQUA| Region: Western Region,228,228,1/3/2013Amended 4/22/2013,"Layoffs will commence on June 15, 2013, or within fourteen (14) days of that date, and run until the closing is completed which is anticipated in the Summer of 2013.",Summer 2013,Economic,Plant Closing,Plant Closing,The employees are not represented by a union.,"Alice Clark, Vice President, Labor and Employee Relations",(314) 877-7189,4083
"ARAMARK Business Dining ServicesJPMC Midtown/Downtown AV270 Park AvenueNew York, NY 10017",Food Services,New York | WIB Name: NEW YORK CITY | Region: New York City,49,49,4/19/2013,-----,7/17/2013,Loss of Contract,Plant Closing,Plant Closing,Local 1-Iatse,"Susan Eisma, Regional Human Resources Director",(860) 920-5013,4080
"Advanced Monolythic Ceramics, Inc.3101 Constitution AevnueOlean, NY 14760",Ceramic Manufacturing,Cattaragus | WIB Name: ALL/CAT| Region: Western Region,65,65,2/4/2013Amended 4/18/2013,"Layoffs will be conducted in Phases beginning on 5/10/2013, with the expected final closing on August 30, 2013.",8/31/2013,Economic/Consolidation of manufacturing to CA site,Plant Closing,Plant Closing,Employees do not have bumping rights.,"Susan Farinacci, Director Human Resources",(805) 389-1166,4079
"Aeroground, Inc. d/b/a Menzies AviationJKF International Airport75 North Hanger RoadJamaica, NY 11430",Cargo handling operation,Queens | WIB Name: NEW YORK CITY| Region: New York City,72,72,4/17/2013,-----,6/29/2013,Economic,Plant Closing,Plant Closing,No bumping rights allowed and employees are not represented by any labor or other organization.,"Rosette Pereira, HR Rep",(718) 301-1842,4078
"Anchor Tank Lines LLC19-01 Steinway StreetAstoria, NY 11105",Transportation & bulk carrier industry,Queens | WIB Name: NEW YORK CITY| Region: New York CitySuffolk | WIB Name: SUFFOLK| Region: Long IslandOrange | WIB Name: ORANGE| Region: Mid-Hudson Region,67,67,4/11/2013,-----,7/7/2013,Economic,Plant Closing,Plant Closing,Teamsters Local 533 IBT,Kim Bruno,(718) 932-9075,4077
"BorgWarner Morse TEC/Powerdered Metal Operation (PMO)3690 Luker RoadCortland, NY 13045",Automobile parts manufacturing & testing,Cortland | WIB Name: CAYUGA/CORT| Region: Central RegionCounty: Tompkins / WIB Name: TOMPKINS /Region: Southern Region,-----,35,1/18/2013Amended:4/16/2013,Layoffs will occur between 5/10/2013 and 10/31/2013.,10/31/2013,Economic,Plant Closing,Plant Closing,Teamsters Local 317,"Michael Rubino, Senior Manager, Human Resources and Labor Relations",(607) 266-5247,4076
"The Food Emporium Store #7291660 Second AvenueNew York, NY 10021",Grocery Store,New York | WIB Name: NEW YORK CITY| Region: New York City,67,67,4/16/2013,-----,5/31/2013,Economic,Plant Closing,Plant Closing,"UFCW Local 342, UFCQ/RWDSU Local 338","Derek Kinney, Vice President, Human Resources & Labor Relations",(201) 571-4018,4075
"Priority Production Services, LLCUnited Nations Headquarters42nd & 1st AvenueNew York, NY 10017",Television and Radio broadcasts,New York | WIB Name: NEW YORK CITY| Region: New York City,102,102,4/16/2013,-----,6/30/2013,Cessation of contract,Plant Closing,Plant Closing,"Local 1212, IBEW","Todd A. Osburn, Vice President",(312) 849-0006,4074
"Mile Square Transportation, Inc.5 Walsh BoulevardPeekskill, NY 10566",Transportation,Yonkers | WIB Name: WESTCH/PTNM | Region: Mid-Hudson Region,102,102,4/15/2013,-----,6/21/2013,Economic,Plant Closing,Plant Closing,Local 456 IBT,Ana Hernandez,(914) 338-7202,4073
"Gleacher & Company Securities Inc.1290 Avenue of the AmericasNew York, NY 10104",Savings and Securities,New York | WIB Name: NEW YORK CITY | Region: New York City,-----,57,4/12/2013,4/10/2013,------,Economic,Plant Layoff,Plant Layoff,No union representation and no bumping rights exist.,Ms. Arciero-Craig,(212) 273-7305,4072
"Time Warner Cable109-15 14th AvenueCollege Point, NY",Telecommunications provider- inbound sales department,Queens | WIB Name: NEW YORK CITY| Region: New York City,120,120,4/10/2013,First separation to occur on 7/11/2013,-----,Economic,Plant Layoff,Plant Layoff,No union representation at this facility and no bumping rights exist.,"Connie Cilberti, Vice President, Human Resources-NYC & Northeast",(212) 420-5503,4071
"Belden, Inc.224 North Main Street, Building KHorseheads, NY 14845",Signal Transmission Device Manufacturing Plant,Chemung | WIB Name: CSS| Region: Southern Region,173,173,4/10/2013,To occur between 7/9/2013 and 11/30/2013,11/30/2013,Production relocation to Syracuse,Plant Closing,Plant Closing,No bumping rights exist.,"Leah Tate, Director, Human Resources",(317) 818-6342,4070
"The Children's Aid Society @ Carmel Hill Apartment Building69 West 118th StreetNew York, NY 10026",Family Services,New York/Bronx | WIB Name: NEW YORK CITY| Region: New York City,-----,2,4/4/2013,6/30/2013,-----,Funding and Budget Cuts – Homemakers unit funding cut and some budget cuts occuring in these layoffs,Plant Layoff,Plant Layoff,There are no bumping rights applicable to this layoff.,"Warren Petty, Talent Management and Human Resource Director",(212) 284-4590,4069
"Cookies on Webster Inc.2543 Webster AvenueBronx, NY",Department Store,Bronx | WIB Name: NEW YORK CITY| Region: New York City,124,124,4/9/2013,Will commence on 6/10/2013 and continue until 6/20/2013,6/20/2013,Economic,Plant Closing,Plant Closing,No union representing employees at this facility.,David Chalom,(718) 797-3300,4068
"Cassidy J Inc.@ Railex LLC105 Rotterdam Industrial ParkSchenectady, NY 12306",Unload Train Cars,Schenectady | WIB Name: CAPITAL DISTRICT| Region: Capital Region,91,91,4/6/2013,-----,4/13/2013,Loss of Contract,Plant Closing,Plant Closing,-----,"Michael. R. Kujath, President",(518) 844-1340,4067
"Xerox Business Services @ Xerox Federal Government Solutions501 Bleeker StreetUtica, NY",Administrative support staff involved in Federal Student Loans,Oneida | WIB Name: HMO| Region: Mohawk Valley Region,----,149,4/6/2013,Will commence on 7/19/2013 and should conclude on or around 8/1/2013,8/1/2013,Loss of Service Contract,Plant Unit Closing,Plant Unit Closing,-----,"Janelle R. Burns, SPHR, Sr. HR Consultant",(801) 567-5466,4066
"Covidien5439 State Route 40Argyle, NY 12809",Manufacturing of medical devices,Washington | WIB Name: SAR/WAR/WAS| Region: Capital Region,183,183,4/8/2013,To commence on 1/4/2013 and continue through closing on 6/30/2014,6/30/2014,Economic,Plant Closing,Plant Closing,None of these individual are represented by a union.,"Carrie Armenio, SPHR, Plant HR Manager",(518) 638-1202,4065
"Duty Free AmericasJohn F. Kennedy Airport Delta Terminal 3Jamaica, NY 11430",Retail Store,Queens | WIB Name: NEW YORK CITY| Region: New York City,63,63,3/7/2013Amended 4/8/2013,-----,5/31/2013,Economic,Plant Closing,Plant Closing,United Food and Commercial Workers Union Local 1102,"Jeannette Brea, Director Human Resources",(718) 425-5606,4064
"Mar-Can Transportation Co. Inc.318 East Third StreetMount Vernon, NY 10553",School Bus Transportation,Westchester | WIB Name: WESTCH/PTNM| Region: Mid-Hudson Region,124,124,4/8/2013,,6/30/2013,Loss of NYCDOE contract,Plant Closing,Plant Closing,,"Deborah Lloyd, Operations Manager",(914) 668-3772,4063
"B-Alert Inc.318 East Third StreetMount Vernon, NY 10553",School Bus Transportation,Westchester | WIB Name: WESTCH/PTNM| Region: Mid-Hudson Region,125,125,4/8/2013,-----,6/30/2013,Loss of New York City Department Of Education contract,Plant Closing,Plant Closing,Local I.B.T.,"Deborah Lloyd, Operations Manager",(914) 668-3772,4062
"Rainbow Transit, Inc.4-09 26th AvenueLong Island City, NY 11102",Transportation,Queens | WIB Name: NEW YORK CITY| Region: New York City,93,93,3/26/2013,,6/26/2013,Economic,Plant Closing,Plant Closing,Bumping rights do not exist.,Indra Fouche,(718) 932-1500 Ext 101,4061
"Lurays Travel, LTD.4-09 26th AvenueLong Island City, NY 11102",Transportation,Queens | WIB Name: NEW YORK CITY| Region: New York City,23,23,3/26/2013,,6/26/2013,Economic,"Plant ClosingAdditional Lurays Travel Ltd. Sites affected2012-0246: 11-08 30th Avenue, Long Island City, NY 11102 - 25 affected",Plant Closing,Bumping rights do not exist.,Indra Fouche,(718) 932-1500 Ext 101,4060
"Citywide Transit, Inc.4-09 26th AvenueLong Island City, NY 11102",Transportation,Queens | WIB Name: NEW YORK CITY| Region: New York City,56,56,3/26/2013,,6/26/2013,Economic,Plant Closing,Plant Closing,Bumping rights do not exist.,Indra Fouche,(718) 932-1500 Ext 101,4059
"CIFRA Escorts Inc. 4-09 26th AvenueLong Island City, NY 11102",Transportation,Queens | WIB Name: NEW YORK CITY| Region: New York City,197,197,3/26/2013,,6/26/2013,Economic,Plant Closing,Plant Closing,Bumping rights do not exist.,Indra Fouche,(718) 932-1500 Ext 101,4058
"All American School Bus Corp.4-09 26th AvenueLong Island City, NY 11102",Transportation,Queens | WIB Name: NEW YORK CITY| Region: New York City,24,24,3/26/2013,,6/26/2013,Economic,Plant Closing,Plant Closing,Bumping rights do not exist.,Indra Fouche,(718) 932-1500 Ext 101,4057
"Forty Six O Seven Co., Inc. - IHOP73-01 Northern BoulevardJackson Heights, NY 11372",Restaurant,Queens | WIB Name: NEW YORK CITY | Region: New York City,42,42,4/5/2013,-----,3/24/2013,Closed for repairs due to a fire-repairs may for a period of time that may exceed 6 months,Plant Closing,Plant Closing,UNITE HERE Local 100,"Terry Case, Vice President of Operations",(203) 417-6326,4056
,Nursing Home,Jefferson | WIB Name: JEFF/LEWIS | Region: North Country Region,240,240,11/6/2012 Amended 4/5/2013,Postponed to occur between 4/5/2013-4/18/2013,4/18/2013,Economic,Plant Closing,Plant Closing,1199 SEIU United Healthcare Workers East,"Dennis Casey, Administrator",(315) 785-7400,4055
"Kaye Scholer LLP425 Park AvenueNew York, NY 10022",Law firm,New York | WIB Name: NEW YORK CITY| Region: New York City,total number yet to be confirmed,48,2/28/2013Amended 4/4/2013,Will occur between 5/31/2013 and 7/31/2014,7/31/2014,"Relocation of Administrative/Support staff to Tallahassee, Florida",Plant Unit Closing,Plant Unit Closing,None of the affected employees are members of a labor organization.,Dana Morgan,(212) 836-8330,4054
"Kaye Scholer LLP425 Park AvenueNew York, NY 10022",Law firm,New York | WIB Name: NEW YORK CITY| Region: New York City,total number yet to be confirmed,2,4/4/2013,6/30/2013,7/31/2014,"Relocation of Administrative/Support staff to Tallahassee, Florida",Plant Unit Closing,Plant Unit Closing,None of the affected employees are members of a labor organization.,"Dana Morgan, Human Resources Manager",(212) 836-8330,4053
"Grenadier Realty Corp. - New York City Housing Authority - UAC1925 Harrison AvenueBronx, NY 10462",Property Management Services,Bronx/Kings| WIB Name: NEW YORK CITY| Region: New York City,14,14,3/27/2013,-----,3/31/2013,Contract Loss with New York City Housing Authority,Plant Closing,Plant Closing,No bumping rights exist.,"Roderick Robertson, Director, Human Resources",(718) 642-2550,4049
"Bank of America475 Cross Point ParkwayGetzville, NY 14608",Bank,Erie | WIB Name: ERIE| Region: Western Region,1320,1320,4/1/2013,-----,6/23/2013,Site Acquisition,Plant Closing,Plant Closing,-----,"John Collingwood, Senior Vice President",(202) 661-7130,4048
"Kaye Scholer LLP425 Park AvenueNew York, NY 10022",Law firm,New York | WIB Name: NEW YORK CITY| Region: New York City,total number yet to be confirmed,48,2/28/2013Amended 4/2/2013,Will occur between 5/31/2013 and 7/31/2014,12/31/2013,"Relocation of operations to Tallahassee, Florida",Plant Closing,Plant Closing,None of the affected employees are members of a labor organization.,Dana Morgan,(212) 836-8330,4047
