Company,Business Type,County,Total Employees,Number Affected,Date of Notice,Layoff Date,Closing Date,Reason for Dislocation,Classification,Reason Stated for Filing,Union,Contact,Phone,Case_ID
"Kaye Scholer LLP425 Park AvenueNew York, NY 10022",Law firm,New York | WIB Name: NEW YORK CITY| Region: New York City,total number yet to be confirmed,6,6/20/2013Amended 12/31/2013,Between 9/3/2013 and 4/30/2014,7/31/2014,"Relocation of Administrative/Support staff to Tallahassee, Florida",Plant Unit Closing,Plant Unit Closing,None of the affected employees are members of a labor organization.,"Dana Morgan, Human Resources Manager",(212) 836-8330,4422
"Kaye Scholer LLP425 Park AvenueNew York, NY 10022",Law firm - Administrative Support Staff,New York | WIB Name: NEW YORK CITY| Region: New York City,Total number yet to be confirmed.,2,10/3/2013Amended 12/31/2013,12/31/2013; 1 employee layoff postponed to occur on 3/31/2014,7/31/2014,Relocation of administrative support function to Tallahassee Florida,Plant Unit Closing,Plant Unit Closing,None of the affected employees are members of a union.,"Dana Morgan, Human Resources Manager",(212) 836-8330,4421
"Shorefront Center for Rehabilitation & Nursing Care3015 W. 29th StreetBrooklyn, NY 11224",Nursing Home,Kings | WIB Name: NEW YORK CITY| Region: New York City,482,482,12/30/2013,Undetermined at this time.,Anticipated to occur on 3/31//2014.,Sale of Business,Plant Closing,Plant Closing,1199 SEIU,"Elliot Brooks, Senior Vice President, HR",(718) 630-2555,4420
"Loehmann's, Inc.2500 Halsey StreetBronx, NY 10461",Corporate office,Bronx | WIB Name: NEW YORK CITY| Region: New York City,123,63,12/17/2013Amended 12/30/2013,Began on 10/30/2013 and have occurred in phases through 2/2/2014 until windown of operations is complete.,2/28/2014,Bankruptcy-sale of assets,Plant Closing,Plant Closing,There are no bumping rights.,"Nancy Straface, Senior Vice President",(718) 430-5308,4419
"Diamond Back GroupEastman Kodak CorporationRochester, NY",Janitorial Services,Monroe | WIB Name: MONROE| Region: Finger Lakes Region,45,45,12/23/2013,-----,12/31/2013,Contract Termination,Plant Closing,Plant Closing,Bumping rights do not exist.,Ted Nall,(713) 267-9381,4418
"St Francis Hospital and Health Centers – Main Hospital 241 North RoadPoughkeepsie, NY 12601",Hospital and Health Centers,Dutchess| WIB Name: DUTCHESS/PUTNAM| Region: Mid-Hudson RegionUlster | WIB Name: ULSTER| Region: Mid-Hudson Region,1141,1141,12/26/2013,To commence on 3/20/2014 or within 14 days thereafter,4/4/2014,Economic,Plant Closing,Plant Closing,"Service Employees International Union (SEIU), 1199 United Healthcare Workers East","George M. Prisco, Vice President, Human Resources",(845) 431-8127,4417
"Hakkasan NYC, LLC311 W. 43rd StreetNew York, NY 10036",Restaurant,New York | WIB Name: NEW YORK CITY| Region: New York City,138,138,10/3/2013,1/4/2014,-----,"Restaurant will not close, but will be managed by another employer.",Plant Layoff,Plant Layoff,The affected employees do not belong to a union.,"Kaitlin Barry, Human Resources Manager",(415) 852-7958,4416
"Reliant Transportation, Inc.297 Norman AvenueBrooklyn, NY 11222",Transportation,Kings | WIB Name: NEW YORK CITY | Region: New York City,847,847,12/20/2013,-----,To be determined,Reassigning routes to All American School Bus Corp,Plant Closing,Plant Closing,"Local Union #1181-1061 Amalgamated Transit Union, AFL-CIO","Adem Adem, North East Vice-Resident MV Transportation",(347) 739-0205,4415
"Smithfield Associates LLC-Pastis Restaurant9 Ninth AvenueNew York, NY 10014",Restaurant,New York | WIB Name: NEW YORK CITY | Region: New York City,200,200,9/30/2013Amended: 12/26/2013,-----,1/31/2014,Economic,Plant Closing,Plant Closing,There are no bumping rights.,"Yvette Rivera, Director of Human Resources",(212) 925-5340 X 255,4413
"Friendly's Foods LLC dba Pulino's Bar & Pizzeria282 BoweryNew York, NY 10012",Restaurant,New York | WIB Name: NEW YORK CITY | Region: New York City,61,61,10/7/2013Amended: 12/26/2013,"All affected employees will be terminated on January 5, 2014.",12/29/2013,Economic,Plant Closing,Plant Closing,Affected employees are not represented by a union.,"Yvette Rivera, Director of Human Resources",(212) 925-5340,4412
"Circor Flow Technologies Spence Engineering Company150 Coldenham RoadWalden, NY 12586",Manufacturer of steam specialty & fluid control devices,Orange | WIB Name: ORANGE | Region: Mid-Hudson Region,91,55,8/19/2013  Amended: 12/23/2013,To occur between 11/30/2013 and 3/31/2014.,-----,Economic,Plant Layoff,Plant Layoff,International Association of Machinist and Aerospace Workers Union (IAM),Sharon Bruel,(845) 778-6232,4410
"Eastman Kodak Company (Eastman Park)1669 Lake AvenueRochester, NY 14650",Photographic equipment and Supplies,Monroe | WIB Name: MONROE | Region: Finger Lakes Region,-----,3,12/19/2013,3/13/2014,-----,Economic,Plant Layoff,Plant Layoff,There is no employee representative of record.,"Mary C. Lazzar-Whyte, Director, HR Americas Employee Services",(585) 781-1896,4409
"Eastman Kodak Kodak Office343 State StreetRochester, NY 14650",Photographic equipment and supplies,Monroe | WIB Name: MONROE | Region: Finger Lakes Region,-----,4,11/29/2013  Revised: 12/19/2013,2/11/2014,-----,Economic,Plant Layoff,Plant Layoff,There is no employee representative of record.,"Mary C. Lazzar-Whyte, Director, HR Americas Employee Services",(585) 781-1896,4408
"Delaware North Companies Travel Hospitality Services, Inc.Syracuse Hancock International Airport, 1000 Colonel Eileen Collins BoulevardN. Syracuse, NY 13212",Food and Beverage Concessions,Onondaga | WIB Name: ONONDAGA| Region: Central Region,80,80,12/17/2013Amended 12/18/2013,-----,3/31/2014,Expired lease agreement,Plant Closing,Plant Closing,UNITE HERE,"Justine Moretta, HR Business Partner",(716) 858-5083,4407
"Keywell, L.L.C.300 Falconer StreetFrewsburg, NY 14738",Aerospace Metals and Specialty Steels recycling,Chautauqua | WIB Name: CHAUTAUQUA | Region: Western Region,49,49,8/30/2013Amended: 12/18/2013,Terminations will take place 9/6/2013 through 9/19/2013 and 12/31/2013 through 1/13/2014.,12/17/2013,Economic,Plant Closing,Plant Closing,"United Steel, Paper and Forestry, Rubber, Manufacturing, Energy, Allied Industrial and Service Workers International Union, AFL-CIO, CLC, on behalf of USW Local 9367.","Jack Joyce, Vice President - HR",(773) 660-2060 ext. 235,4406
"Delaware North Companies Travel Hospitality Services, Inc.Syracuse Hancock International Airport, 1000 Colonel Eileen Collins BoulevardN. Syracuse, NY 13212",Food and Beverage Concessions,Onondaga | WIB Name: ONONDAGA| Region: Central Region,93,93,12/17/2013,-----,3/31/2014,Expired lease agreement,Plant Closing,Plant Closing,UNITE HERE,"Justine Moretta, HR Business Partner",(716) 858-5083,4405
"Loehmann's, Inc.2500 Halsey StreetBronx, NY 10461",Corporate office,Bronx | WIB Name: NEW YORK CITY | Region: New York City,63,63,12/17/2013,Began on 10/30/2013 and have occurred in phases until the office closed on 12/16/2013.,12/16/2013,Bankruptcy-sale of assets,Plant Closing,Plant Closing,There are no bumping rights.,"Nancy Straface, Senior Vice President",(718) 430-5308,4404
"SUNY Downstate Medical Center at LICH - StaffCo.339 Hicks StreetBrooklyn, NY 11201",Medical Center,Kings | WIB Name: NEW YORK CITY | Region: New York City,"1,442","1,442",3/25/2013 Amended: 12/16/2013,Layoffs are postponed to occur between 1/21/2014 and 2/3/2014,Postponed to occur between 1/21/2014 and 2/3/2014,Economic,Plant Closing,Plant Closing,"1199 SEIU United Healthcare Workers East, New York State Nurses Association, Local 30 & 30 A-B-C-D of the International Union of Operating Engineers, and Special and Superior Officers Benevolent Association","Francesca Tinti, Assistant Vice President for Human Resources",(718) 780-1500,4403
"LIR Management Corp/Food Court1 Penn PlazaNew York, NY 10001",Food service establishments,New York | WIB Name: NEW YORK CITY | Region: New York City,124,124,12/12/2013,-----,3/16/2014,Economic,Plant Closing,Plant Closing,Unite Here Local 100,"Ann Martinez, CFO",(212) 560-1658,4402
"Worthington Cylinders (formerly BernzOmatic)One BernzOmatic DriveMedina, NY 14103",Hand & Edge Tool Manufacturing,Orleans | WIB Name: GLOW | Region: Finger Lakes Region,155,155,12/12/2013,Will occur in stages beginning on 3/1/2014 and will run through closing date with a few employees remaining after the closing to wind down operations.,5/1/2014,Relocating operations to Wisconsin plant,Plant Closing,Plant Closing,Workers United Local 1802,"Dan Thomas, Human Resources Manager",(513) 539-6302,4401
"RJM Acquisitions LLC575 Underhill Blvd, Suite 224Syosset, NY 11791",Debt collection,Oyster Bay | WIB Name: OYSTER BAY| Region: Long Island,55,Undetermined at this time,12/10/2013,3/10/2014,-----,Economic,Plant Layoff,Plant Layoff,There are no bumping rights.,"Jamie Rozansky, Director of Operations",(516) 714-1305,4399
"Interfaith Medical Center1545 Atlantic AvenueBrooklyn, NY 11213",Medical Center,Kings | WIB Name: NEW YORK CITY | Region: New York City,1405,1405,8/2/2013 Amended: 12/10/2013,"Layoffs are postponed to commence on December 26, 2013, or within 14 days thereafter.",Undetermined at this time,Funding cuts,Plant Closing,Plant Closing,"1199 SEIU United Healthcare Workers East, New York State Nurses Association, NYSNA, The Committee of Residents and Interns/SEIU, New York State Federation of Physicians and Dentists, AFL-CIO","M. Denise McLellan, SPHR, CEBS, Director of Human Resources",(718) 613-6560,4398
"AVON - Service Model Transformation Project (SMT)44 South BroadwayWhite Plains, NY 10601",Beauty Supplies for Women,Westchester | WIB Name: WESTCHESTER | Region: Mid-Hudson Region,130,130,12/10/2013,-----,3/10/2014,Economic,Plant Closing,Plant Closing,No bumping rights exist.,"Lara Braca, Senior Manager, Human Resources",(914) 288-1961,4397
"Sterling National Bank145 East 40th StreetNew York, NY 10017",Bank,New York | WIB Name: NEW YORK CITY| Region: New York City,-----,2,12/9/2013,To occur between 2/10/2014 and 3/11/2014,-----,Economic,Plant Layoff,Plant Layoff,There are no bumping rights for Sterling employees.,"Jean Strella, M.S., CBP, CCP, SPRH, Senior Vice President",(845) 369-8086,4396
"VNS CHOICE Community Care (VNSNY)1200 Waters PlaceBronx, NY 10461",Visiting Nurse Service,New York/Bronx/Kings/Queens | WIB Name: NEW YORK CITY | Region: New York CityOyster Bay/Hempstead | WIB Name: OYSTER BAY| Region: Long Island,-----,37,10/28/2013 Amended 12/9/2013,1/24/2014,-----,Economic,Plant Layoff,Plant Layoff,United Federation of Teachers,"Marian Hass, Vice President, Human Resources Policy & Practice",(212) 609-7880,4395
"The River Club of New York, Inc.447 East 52nd StreetNew York, New York 10022",Private Country Club,New York | WIB Name: NEW YORK CITY| Region: New York City,90,90,10/9/2013Rescinded: 12/6/2013,12/31/2013,12/31/2013,Potential loss of lease. (A lease extension has been granted through June 2014).,Potential Plant Closing,Potential Plant Closing,"New York Hotel & Motel Trades Council, Local 6","Eric Ruehlmann, General Manager",(212) 751-0100 x115,4393
"Bombardier Mass Transit Corporation-Overhaul Division7940 State Route 415Bath, NY 14810",Rail equipment manufacturing,Steuben | WIB Name: CSS | Region: Southern Region,42,0,10/10/2013,"The affected employees will be separated between January 17, 2014 and January 31, 2014.",-----,Economic,Plant Layoff,Plant Layoff,The affected employees are not represented by a union.,"Tracy Tirrell, Human Resources",(609) 315-0630,4391
"Bombardier Mass Transit Corporation-Overhaul Division7940 State Route 415Bath, NY 14810",Rail equipment manufacturing,Steuben | WIB Name: CSS| Region: Southern Region,42,6,10/3/2013 Amended 12/6/2013,"Separations will occur between January 10, 2014 and January 24, 2014.",-----,Economic,Plant Layoff,Plant Layoff,The affected employees are not represented by a union.,"Tracy Tirrell, Human Resources",(609) 315-0630,4390
"Bombardier Mass Transit Corporation-Overhaul Division7940 State Route 415Bath, NY 14810",Rail equipment manufacturing,Steuben | WIB Name: CSS | Region: Southern Region,-----,15,9/27/2013 Amended 12/6/2013,"15 total, 12 affected on 12/27/2013, 3 affected on 1/3/2014",-----,Economic,Plant Layoff,Plant Layoff,There is no employee representative.,"Tracy Tirrell, Human Resources",(609) 315-0630,4389
"Residence Inn by Marriott, LLC @ Residence Inn Fishkill14 Schuyler BlvdFishkill, NY 12524",Residential Hotel,Dutchess | WIB Name: DUTCHESS| Region: Mid-Hudson Region,32,32,9/30/2013  Amended: 12/4/2013,To occur between 1/31/2014 and 2/13/2014,1/31/2014,"The Residence Inn by Marriott, LLC will permanently cease managing the Residence Inn Fishkill. New management will take over this function.",Plant Closing,Plant Closing,Affected employees will have no bumping rights.,"Laila Batista, Acting General Manager",(845) 896-5210,4387
"Spellman High Voltage Electronics Corporation475 Wireless Blvd.Hauppauge, NY 11788",High Voltage Power Supplies Manufacturing,Suffolk | WIB Name: SUFFOLK | Region: Long Island,290,27,11/26/2013  Amended 12/2/2013,2/3/2014,-----,"Relocation of jobs to Matamoros, Mexico",Plant Layoff,Plant Layoff,There are no bumping rights and the employees are not represented by any union.,"Erica Simon, Human Resources",(631) 630-3695,4383
"Eastman Kodak Kodak Office343 State StreetRochester, NY 14650",Photographic equipment and supplies,Monroe | WIB Name: MONROE | Region: Finger Lakes Region,-----,4,11/29/2013,11/14/2013,-----,Economic,Plant Layoff,Plant Layoff,There is no employee representative of record.,"Mary C. Lazzar-Whyte, Director, HR Americas Employee Services",(585) 781-1896,4382
"Spellman High Voltage Electronics Corporation475 Wireless Blvd.Hauppauge, NY 11788",High Voltage Power Supplies Manufacturing,Suffolk | WIB Name: SUFFOLK | Region: Long Island,-----,47 in both locations,11/26/2013,2/3/2014,-----,"Relocation of jobs to Matamoros, Mexico",Plant Layoff,Plant Layoff,There are no bumping rights and the employees are not represented by any union.,"Erica Simon, Human Resources",(631) 630-3695,4381
"PricewaterhouseCoopers LLP300 Madison AvenueNew York, NY 10017","Audit and assurance, tax, and consulting services",New York | WIB Name: NEW YORK CITY | Region: New York City,-----,27,11/25/2013,2/28/2014,-----,Economic,Plant Layoff,Plant Layoff,There are no bumping rights in connection with these separations.,"Timothy Grimes, Managing Director, US IT Operations",(813) 348-7334,4379
"Juicy Couture, Inc.1440 BroadwayNew York, NY 10018",Retail Clothing Sales,New York | WIB Name: NEW YORK CITY | Region: New York City,-----,61,11/25/2013,Will commence on 11/22/2013 and continue in phases through 1/31/2014,-----,Sale of business to a third party,Plant Layoff,Plant Layoff,There are no bumping rights and there is no employee representative.,"Jean-Rose Bishop, Director of Human Resources",(201) 295-7531,4378
"Fab.com, Inc.95 Morton StreetNew York, NY 10014",Operates online pop-up sales,New York | WIB Name: NEW YORK CITY | Region: New York City,-----,79,11/21/2013,2/15/2014,------,Economic,Plant Layoff,Plant Layoff,"None of the affected employees are represented by a union, and none are entitled to bumping rights pursuant to a collective bargaining agreement or otherwise.","Allison Rutledge-Parisi, Chief People Officer",(646) 684-3076,4377
"SUNY Downstate Medical Center  at LICH - StaffCo. 339 Hicks Street Brooklyn, NY 11201",Medical Center,Kings | WIB Name: NEW YORK CITY| Region: New York City,"1,442","1,442",3/25/2013Amended: 11/20/2013,Layoffs are postponed to occur between 12/16/2013 and 12/29/2013,Postponed  to occur between 12/16/2013  and 12/29/2013,Economic,Plant Closing,Plant Closing,"1199 SEIU United Healthcare Workers East, New York  State Nurses Association, Local 30 & 30 A-B-C-D of the International Union  of Operating Engineers, and Special and Superior Officers Benevolent  Association","Francesca  Tinti, Assistant Vice President for Human Resources",(718) 780-1500,4376
"First National Bank of New York538 Broadhollow RoadMelville, NY 11747",Bank,Suffolk | WIB Name: SUFFOLK| Region: Long Island,36,36,11/19/2013,-----,2/14/2014,Merger,Plant Closing,Plant Closing,Bumping rights do not exist.,"Deborah McGrory, Senior Vice President, Director of Human Resources",(631) 537-1000 Ext 7297,4375
"12th Restaurant Inc. (Nathan's/ Roy Roger's/Tim Horton's - Food Court)401 Seventh AvenueNew York, NY",Restaurants,New York | WIB Name: NEW YORK CITY| Region: New York City,21,21,11/14/2013,2/18/2014 or during the 14-day period following that date to wind down operations,2/18/2014,Economic,Plant Closing,Plant Closing,Unite Here Local 100 Union,"Ann Martinez, CFO",(212) 560-1658,4374
"Excelsior Packaging Group 159 Alexander Street Yonkers, NY 10701","Manufacturing: cellophane bags, wrapper and seal  printing and engraving service",Westchester | WIB Name: WESTCHESTER| Region: Mid-Hudson  Region,112,112,11/12/2013,-----,2/5/2014,Economic,Plant Closing,Plant Closing,"Consolidated Commercial Workers of America, Local 528",Ronnie Shemesh,(914) 968-1300,4373
"PLPL Development, LLC d/b/a Budwey's Supermarket416 Kenmore AvenueBuffalo, NY 14223",Supermarket,Erie | WIB Name: ERIE | Region: Western Region,156,156,11/13/2013,-----,2/7/2014,Sale of Business to Dash's Market,Plant Closing,Plant Closing,No bumping rights exist.,"Frank Budwey, Owner",(716) 807-5362,4372
"Atlantic Express Transportation Corp. including all subsidiaries below:127-45 34th AvenueFlushing, NY 11368",Transportation,Queens/Kings/Bronx/Richmond | WIB Name: NEW YORK CITY | Region: New York City Oyster Bay/Hempstead | WIB Name: OYSTER BAY/HEMPSTEAD | Region: Long Island,199,199,11/13/2013,-----,12/31/2013,Economic,Plant Closing,Plant Closing,Amalgamated Transit Union Local 1181,"Jerome Dente, Chief Operating Officer",(718) 442-7000,4371
"Sterling National Bank500 7th AvenueNew York, NY 10018",Bank,New York | WIB Name: NEW YORK CITY | Region: New York CityOyster Bay | WIB Name: OYSTER BAY | Region: Long IslandRockland | WIB Name: ROCKLAND | Region: Mid-Hudson Region,-----,16,11/8/2013,To occur between 2/2/2014 and 3/31/2014,-----,Economic,Plant Layoff,Plant Layoff,There are no bumping rights for Sterling employees.,"Jean Strella, M.S., CBP, CCP, SPRH, Senior Vice President",(845) 369-8086,4370
"Pfizer Inc.64 Maple StreetRouses Point, NY 12979",Pharmaceuticals,Clinton | WIB Name: C-E-F-H| Region: North Country Region,-----,31-11 non-union and 20 union,10/22/2013Amended 11/12/2013,31-30 to be separated on 1/25/2014 and one worker to be separated on 2/8/2014,12/31/2013,Economic,Plant Closing,Plant Closing,Local 95c International Chemical Workers Union/UFCW,"Elaine Reynolds, Senior Manager, Human Resources",(518) 297-1697,4369
"Interfaith Medical Center1545 Atlantic AvenueBrooklyn, NY 11213",Medical Center,Kings | WIB Name: NEW YORK CITY | Region: New York City,1542,1542,8/2/2013 Amended: 11/8/2013,"Layoffs scheduled to commence on October 25, 2013, are now postponed and are expected to commence on November 22, 2013, or within 14 days thereafter.",Undetermined at this time,Funding cuts,Plant Closing,Plant Closing,"1199 SEIU United Healthcare Workers East, New York State Nurses Association, NYSNA, The Committee of Residents and Interns/SEIU, New York State Federation of Physicians and Dentists, AFL-CIO","M. Denise McLellan, SPHR, CEBS, Director of Human Resources",(718) 613-6560,4367
"The Bon Ton Stores Inc.15 Miracle Mile DriveRochester, NY 14623",Retail Store,Monroe | WIB Name: MONROE | Region: Finger Lakes Region,73,73,11/5/2013,2/7/2014,3/26/2014,Lease will not be renewed,Plant Closing,Plant Closing,No bumping rights for any affected employee.,"Denise Domian, Senior Vice President, Human Resources",(414) 212+-6789,4366
"SUNY Downstate Medical Center at LICH - StaffCo.339 Hicks StreetBrooklyn, NY 11201",Medical Center,Kings | WIB Name: NEW YORK CITY | Region: New York City,"1,469","1,469",3/25/2013 Amended: 11/4/2013,Layoffs are postponed to occur between 11/7/2013 and 11/20/2013,Postponed to occur between 11/7/2013 and 11/20/2013,Economic,Plant Closing,Plant Closing,"1199 SEIU United Healthcare Workers East, New York State Nurses Association, Local 30 & 30 A-B-C-D of the International Union of Operating Engineers, and Special and Superior Officers Benevolent Association","Francesca Tinti, Assistant Vice President for Human Resources",(718) 780-1500,4362
"NCO Financial Systems, Inc. 150 Crosspoint Parkway Getzville, NY 14068",Debt collection agency,Erie | WIB Name: ERIE| Region: Western Region,382,104,10/29/2013Amended: 11/4/2013,To occur  between 10/29/2013 and closing date of  1/27/2014.,1/27/2014,Economic,Plant Layoff,Plant Layoff,Bumping rights do not exist.,"Patti Greene, Employee Relations Manager",(800) 227-4000 Ext 2396,4361
"SUNY Downstate Medical Center at LICH - StaffCo.339 Hicks StreetBrooklyn, NY 11201",Medical Center,Kings | WIB Name: NEW YORK CITY| Region: New York City,1533,1533,3/25/2013Amended: 11/1/2013,Layoffs are postponed to occur between 11/7/2013 and 11/20/2013,Postponed to occur between 11/7/2013 and 11/20/2013,Economic,Plant Closing,Plant Closing,"1199 SEIU United Healthcare Workers East, New York State Nurses Association, Local 30 & 30 A-B-C-D of the International Union of Operating Engineers, and Special and Superior Officers Benevolent Association","Francesca Tinti, Assistant Vice President for Human Resources",(718) 780-1500,4359
"Sylvania Lighting Services Corp.73-06 88h StreetGlendale, NY",Lighting products,Queens | WIB Name: NEW YORK CITY| Region: New York City,47,47,11/1/2013,To commence on 2/1/2014 and continue through March of 2014,3/31/2014,Economic,Plant Closing,Plant Closing,"International Brotherhood of Electrical Workers, Local 3",Michael Amthor,(603) 767-9269,4358
"PJP Health Agency Inc.3 Huntington Quadrangle, Suite 400NMelville, NY 11747",Health Insurance Brokerage,Suffolk | WIB Name: SUFFOLK | Region: Long Island,55,55,10/29/2013,-----,10/21/2013,Loss of operating license,Plant Closing,Plant Closing,-----,"Phillip Teseo, Sr.",(631) 465-8140,4357
"Quandt's Foodservice Distributors, Inc.105 Quist Road PO Box 700Amsterdam, NY 12010",Food Service Product Distributor,Montgomery | WIB Name: FMS | Region: Mohawk Valley Region,-----,116,10/31/2013,To occur between 2/6/2014 and 2/20/2014,-----,Sale of business,Plant Layoff,Plant Layoff,Employees are not unionized and bumping rights do not exist.,"Robert S. Quandt, Chief Executive Officer",(518) 842-1550,4356
"NCO Financial Systems, Inc.150 Crosspoint ParkwayGetzville, NY 14068",Debt collection agency,Erie | WIB Name: ERIE | Region: Western Region,382,102,10/29/2013 Amended 10/31/2013,To occur between 10/29/2013 and closing date of 1/27/2014.,1/27/2014,Economic,Plant Layoff,Plant Layoff,Bumping rights do not exist.,"Patti Greene, Employee Relations Manager",(800) 227-4000 Ext 2396,4355
"Villager Construction Inc.425 Old Macedon Center Rd.Fairport, NY 14450",Construction,Monroe | WIB Name: MONROE| Region: Finger Lakes Region,200,100,10/25/2013,will commence on 9/17/2013 and run through December,-----,Economic,Plant Layoff,Plant Layoff,No union involvement,"Casey L. Leeson, HR Manager",(585) 223-7697 x 126,4354
"NCO Financial Systems, Inc.150 Crosspoint ParkwayGetzville, NY 14068",Debt collection agency,Erie | WIB Name: ERIE | Region: Western Region,101,101,10/29/2013,To occur between 10/29/2013 and closing date of 1/27/2014.,1/27/2014,Economic,Plant Closing,Plant Closing,Bumping rights do not exist.,"Patti Greene, Employee Relations Manager",(800) 227-4000 Ext 2396,4352
"Advanced Institutional Support Services dba AdvancedMealVan Duyn Home and Hospital 5075 W. Seneca TurnpikeSyracuse, NY 13215",Food Services,Onondaga | WIB Name: ONONDAGA | Region: Central Region,58,58,9/27/2013  Amended 10/29/2013,-----,11/30/2013,Sale of business,Plant Closing,Plant Closing,Unite HERE International Union Local 150,"Jocelyn Vega, HR Operations Manager",(315) 413-3144,4351
"VNS CHOICE Community Care (VNSNY)1200 Waters PlaceBronx, NY 10461",Visiting Nurse Service,New York/Bronx/Kings/Queens | WIB Name: NEW YORK CITY| Region: New York CityOyster Bay/Hempstead | WIB Name: OYSTER BAY| Region: Long Island,-----,37,10/28/2013,1/24/2014,-----,Economic,Plant Layoff,Plant Layoff,United Federation of Teachers,"Marian Hass, Vice President, Human Resources Policy & Practice",(212) 609-7880,4350
"Visiting Nurse Service of New York Home Care (VNSNY)5 Penn PlazaNew York, NY 10001",Visiting Nurse Service,New York/Bronx/Kings/Queens | WIB Name: NEW YORK CITY| Region: New York CityOyster Bay/Hempstead | WIB Name: OYSTER BAY| Region: Long Island,-----,5,10/28/2013,1/24/2014,-----,Economic,Plant Layoff,Plant Layoff,United Federation of Teachers,"Marian Hass, Vice President, Human Resources Policy & Practice",(212) 609-7880,4349
"Lenroc, L.P. at the Holiday Inn Hotel222 S. Cayuga StreetIthaca, NY 14850",Hotel,Tompkins | WIB Name: TOMPKINS| Region: Southern Region,95,95,8/26/2013,11/22/2013,11/2/2013,Renovations to Hotel-no renovations to occur,Temporary Plant Closing,Temporary Plant Closing,Bumping rights do not exist for the affected employees as they are all non-union.,Mark Frantz,(716) 893-6551,4345
"Pfizer Inc.64 Maple StreetRouses Point, NY 12979",Pharmaceuticals,Clinton | WIB Name: C-E-F-H| Region: North Country Region,-----,37-11 non-union and 26 union,10/22/2013,36- to be separated on 1/25/2014 and one worker to be separated on 2/8/2014,12/31/2013,Economic,Plant Closing,Plant Closing,Local 95c International Chemical Workers Union/UFCW,"Elaine Reynolds, Senior Manager, Human Resources",(518) 297-1697,4344
