"Catholic Charities Neighborhood Services, Inc. Fidelis Parenting/Fatherhood Program440 Watkins StreetBrooklyn, NY 11212",Fidelis Parenting/Fatherhood Program,Kings | WIB Name: NEW YORK CITY | Region: New York City,6,6,4/7/2017,7/6/2017,7/6/2017,Loss of funding for program.,Plant Unit Closing,Plant Unit Closing,The affected workers are not represented by a union.,"Jacqueline Gibbons, Senior Vice Preident of Human Resources",(718) 722-6181,,2016-0209,5891
"GTA Americas, LLCOperations & Finance Department5 Pennsylvania PlazaNew York, NY 10001",Provide ground travel products and services to the travel industry.,New York | WIB Name: NEW YORK CITY | Region: New York City,190,70,12/6/2016  Amended: 4/11/2017,3/6/2017,Employee separations will occur in phases and will begin during the14-day period starting on 3/6/2017 and run through the 14-day period starting on 12/31/2017.,Outsourcing of its Operations and Finance departments.,Plant Unit Closing,Plant Unit Closing,The affected workers are not represented by a Union.,"Linda Petrone, Head of Human Resources, Americas",(212) 376-5460,,2016-0096,5890
"Ralph Lauren CorporationIT/Ecommerce Unit601 West 26th StreetNew York, NY 10001","Apparel Design, Manufacturing and Retail",New York | WIB Name: NEW YORK CITY | Region: New York City,72 (total unit employees),64,4/4/2017,The date of separations will commence on 4/14/2017 and continue through 6/30/2017.,6/30/2017,Economic,Plant Unit Closing,Plant Unit Closing,The affected workers are not represented by a union.,"Jonathan Shiffman, Esq, Vice President & Associate General Counsel",(212) 705-8281,,2016-0205,5887
"First Student, Inc.1 Wallkill AvenueWallkill, NY 12589",School bus transportation services.,Ulster | WIB Name: ULSTER | Region: Mid-Hudson,238 (total employees),125,4/1/2017,6/30/2017,6/30/2017,Loss of The Valley Central and Wallkill School Districts contract.,Plant Closing,Plant Closing,The Teamsters Local 445,"Melissa Reynolds, Region Human Resources Manager",(607) 346-6820,,2016-0204,5886
"Ralph Lauren Retail, Inc.711 Fifth AvenueNew York, NY 10022",Retail Store,New York | WIB Name: NEW YORK CITY | Region: New York City,125,125,4/4/2017,4/29/2017,4/29/2017,Economic,Plant Closing,Plant Closing,The affected workers are not represented by a union.,"Jonathan Shiffman, Esq., Vice President and Associate General Counsel",(212) 705-8281,,2016-0207,5885
"Guardian News & Media, LLC222 BroadwayNew York, NY 10038",Provide news for an online global audience.,New York | WIB Name: NEW YORK CITY | Region: New York City,10,10,4/3/2017,Separations will occur on 3/31/2017 for eight affected workers and on 6/30/2017 for two afftected workers.,-----,Economic,Plant Layoff,Plant Layoff,The affected workers are not represented by a union.,"Chris Gherardi, Director of Human Resources, US",(917) 900-4672,,2016-0203,5884
"Esplanade of White Plains Venture Partnership d/b/a The Esplanade 95 South BroadwayWhite Plains, NY 10601",Senior Residences,Westchester | WIB Name: WESTCH/PTNM | Region: Mid-Hudson,65,65,4/15/2016 Amended: 5/25/2017,14-day period beginning on 7/14/2016(2 layoffs extended from 14-day period starting on 5/19/2017 to 14-day period starting on 8/18/2017).,8/18/2017 or within 14-days thereafter,Multi-year overhaul of building,Plant Closing,Plant Closing,UNITE HERE Local 100,"Joseph Kaufman, Controller",(914) 761-8100 ext 7124,,,5883
"Chartwells Dining Services c/o Elmira CollegeOne Park PlaceElmira, NY 14901",Food Services,Chemung | WIB Name: CSS | Region: Southern,105,105,3/29/2017Amended: 4/6/2017,6/10/2017,6/10/2017,Loss of Contract,Plant Closing,Plant Closing,The affected workers are not represented by a union.,"Denise Swedish, Field HR Consultant, Compass Group USA, Inc.",(518) 235-9165,,2016-0193,5882
"Kellogg Snacks Hauppauge Distribution Center 55 Gilpin AvenueHauppauge, NY 11788",Distribution center,Suffolk | WIB Name: SUFFOLK | Region: Long Island,16,16,4/6/2017,"The employment separations are expected to occur on the 14-day period between July 8 and July 21, 2017 for hourly employees and August 8 through August 21, 2017 for salaried employees.",8/21/2017,Economic,Plant Closing,Plant Closing,International Brotherhood of Teamsters Local 560,"Joseph Lierz, Director of Labor Relations",(269) 924-2228,,2016-0202,5881
"Kellogg SnacksOrangeburg Distribution Center29 Corporate DriveOrangeburg, NY 10962",Distribution center,Rockland | WIB Name: ROCKLAND | Region: Mid-Hudson,25,25,4/6/2017,"The employment separations are expected to occur on the 14-day period between July 8 and July 21, 2017 for hourly employees and August 8 through August 21, 2017 for salaried employees.",8/21/2017,Economic,Plant Closing,Plant Closing,International Brotherhood of Teamsters Local 560,"Joseph Lierz, Director of Labor Relations",(269) 924-2228,,2016-0201,5880
"NH Jolly MadisonTowers Hotel22 East 38th StreetNew York, NY 10016",Hotel,New York | WIB Name: NEW YORK CITY | Region: New York City,81,81,3/30/2017,6/30/2017,6/30/2017,Hotel closing for renovations.,Plant Closing,Plant Closing,New York Hotel and Motel Trades Council AFL-CIO and UNITE HERE,"Cary Blenner, Director of Human Resources",(212) 802-0600 ext. 7167,,2016-0199,5879
"Otsar Early Childhood Center2324 West 13th StreetBrooklyn, NY 11223",Childcare center,Brooklyn | WIB Name: NEW YORK CITY | Region: New York City,61,61,3/24/2017,6/30/2017,6/30/2017,Economic,Plant Closing,Plant Closing,The affected workers are not represented by a union.,"Meir Zev Pick, Controller of Otsar ECC",(718) 946-7301 (ext.281),,2016-0200,5877
"Community Program Centers of Long Island, Inc. Early Discoveries Center Childcare program2210 Smithtown AvenueRonkonkoma, NY 11779",Childcare program,Suffolk | WIB Name: SUFFOLK | Region: Long Island,112,33,3/29/2017,6/30/2017,6/30/2017,Economic,Plant Unit Closing,Plant Unit Closing,The affected workers are not represented by a union.,"Jayne Mancusi, Director of Human Resources",(631) 232-0011,,2016-0198,5876
"PHH Mortgage Corporation1760 Wehrle DriveWilliamsville, NY 14221",Real Estate Credit,Erie | WIB Name: ERIE | Region: Western,145,69,3/17/2017,6/30/2017,During the second half of 2017.,Reduction in loan originations,Plant Closing,Plant Closing,The affected workers are not represented by a union.,"Terence P. Zirnheld, Director, HR Business Partner",(856) 917-3312,,2016-0180,5875
"PHH Mortgage Corporation1760 Wehrle DriveWilliamsville, NY 14221",Real Estate Credit,Erie | WIB Name: ERIE | Region: Western,254,80,12/15/2016 Amended: 3/30/2017,"The second round of layoffs is scheduled to begin within fourteen days of March 31, 2017. Layoff date postponed for one individual from March 31, 2017 to May 26, 2017.",During the second half of2017.,Reduction in loan originations,Plant Closing,Plant Closing,The affected workers are not represented by a Union.,"Terence P. Zirnheld, Director, HR Business Partner",(856) 917-3312,,2016-0102,5874
"Railex, LLC105 Rotterdam Industrial Park, Bldg. 105Rotterdam, NY 12306",Unload Train Cars,Schenectady | WIB Name: CAPITAL DISTRICT | Region: Capital,138,138,3/28/2017,Separations are expected to occur during the 14-day period commencing on 6/30/2017.,6/30/2017,Loss of Contract,Plant Closing,Plant Closing,The affected workers are not represented by a union.,"Jessica Leuci, CFO",(631) 591-5373,,2016-0189,5873
"ACHIEVE NY (Country Valley Industries - CVI)125 Cutler Pond RoadBinghamton, NY 13905",Help to provide employment for individuals with intellectual and developmental disabilities.,Broome | WIB Name: BROOME/TIOGA | Region: Southern Tioga | WIB Name: BROOME/TIOGA | Region: Southern,35 (total employees at all four locations),5,3/28/2017,The first separation of employees will be no sooner than 6/29/2017. Separations will continuethrough the closure of the manufacturing unit on 9/30/2017.,9/30/2017,Economic,Plant Unit Closing,Plant Unit Closing,The affected workers are not represented by a union.,"Jamie Striley, VP Human Resources",(607) 352-3373,,2016-0194,5872
"Chartwells Dining Services c/o Elmira CollegeOne Park PlaceElmira, NY 14901",Food Services,Chemung | WIB Name: CSS | Region: Southern,105,105,3/29/2017,6/30/2017,6/30/2017,Loss of Contract,Plant Closing,Plant Closing,The affected workers are not represented by a union.,"Denise Swedish, Field HR Consultant, Compass Group USA, Inc.",(518) 235-9165,,2016-0193,5871
"Koi NY Downtown, LLC d/b/a Koi SoHo246 Spring StreetNew York, NY 10013",Restaurant,New York | WIB Name: NEW YORK CITY | Region: New York City,85,85,3/23/2017,6/19/2017,6/19/2017,Economic,Plant Closing,Plant Closing,The affected workers are not represented by a union.,"Suzanne Chou, General Counsel",(310) 659-1555 (ext. 103),,2016-0191,5870
"Eton Park Capital Management, L.P.399 Park Avenue #10New York, NY 10022",A global alternative investment firm.,New York | WIB Name: NEW YORK CITY | Region: New York City,53,53,3/27/2017,6/30/2017,7/31/2017,Economic,Plant Closing,Plant Closing,The affected workers are not represented by a union.,Terry Davis,(212) 756-5367,,2016-0192,5869
"M&G DuraVent, Inc. 10 Jupiter LaneColonie, NY 12205",Venting/Chimney industry.,Albany | WIB Name: CAPITAL DISTRICT | Region: Capital Region,94,53,1/23/2017Amended: 3/29/2017,"Most separations will take place on April 28, 2017, and run through June 30, 2017.",-----,Economic,Plant Layoff,Plant Layoff,The affected workers are not represented by a Union.,"Cathy Winne, Human Resources Manager",(518) 649-9732,,2016-0139,5868
"Exclusive Group Travel999 Stewart Avenue, Suite 210Bethpage, NY 11714",Travel services,Nassau | WIB Name: OYSTER BAY | Region: Long Island,116,116,3/28/2017,7/2/2017,7/2/2017,Economic,Plant Closing,Plant Closing,The affected workers are not represented by a union.,"Jodi Baldassin, Vice President, Human Resources",(516) 828-8214,,2016-0190,5867
"bebe stores, Inc.1 W 34th StreetNew York, NY10001",Clothing Store,New York | WIB Name:NEW YORK CITY | Region: New York City,16,16,3/27/2017 Amemded:5/23/2017,5/27/2017 (14 layoffs extended from 5/27/2017 to 5/31/2017).,5/31/2017,Economic,Plant Closing,Plant Closing,The affected workers are not represented by a union.,"Kristin Jaramillo, Director of Human Resources",(213) 362-2456,,2016-0188,5866
"Allenair CorporationA.K. Allen Co., Inc.Allen Avionics, Inc.255 East Second StreetMineola, NY 11501",Manufacturer of cylinders and accessories.,Nassau | WIB Name: HEMPSTEAD | Region: Long Island,69,69,3/23/2017,"Employees' separation of employment will occur (a) between June 21, 2017 and July 5, 2017; (b) between July 21, 2017 and August 4, 2017; or (c) between September 5, 2017 and September 19, 2017.",9/19/2017,Economic,Plant Closing,Plant Closing,The affected workers are not represented by a union.,"Timothy Byrnes, Assistant Secretary",(516) 747-5450,,2016-0187,5865
"The Research Foundation for The State University of New YorkSmart System Technology and Commercialization Center (STC)5450 Campus DriveCanandaigua, NY14424",Research and Development,Ontario | WIB Name: FINGER LAKES | Region:Finger Lakes Region,30,30,3/24/2017,6/23/2017,6/23/2017,"Transfer ownership of its STC facility to Akoustis Technologies, Inc.",Plant Closing,Plant Closing,The affected workers are not represented by a union.,"Christy Spadaro, Associate VP for Sponsored Programs Human Resources",(518) 956-7293,,2016-0186,5864
"Durham School Services, L.P.830 S. Pearl StreetAlbany, NY 12202",School Transportation Services,Albany | WIB Name: CAPITAL DISTRICT | Region: Capital,216,216,3/24/2017,Separations will occur during the fourteen (14) day period beginning from 6/23/2017 to 7/7/2017.,-----,Loss of Contract,Plant Layoff,Plant Layoff,The affected workers are not represented by a union.,"Christine Matheou, General Manager",(518) 598-0600,,2016-0185,5863
"Altice USA80 Grumman Rd.Bethpage, NY 11714","A multinational cable, fiber, telecommunications, contents and media company.",Nassau | WIB Name: OYSTER BAY | Region: Long Island,98,87,3/20/2017,6/21/2017,6/21/2017,Transitioning warehouse functions to new location.,Plant Closing,Plant Closing,The affected workers are not represented by a union.,"Paul Hilber, Senior VP, Human Resources Business Partner",(516) 803-2426,,2016-0184,5862
"Beth Abraham Nursing Home612 Allerton AvenueBronx, NY 10467",Nursing Home,Bronx | WIB Name: NEW YORK CITY | Region: New York City,580,580,3/4/2016Amended: 3/9/2017,The effective date of the closing changed from 11/30/2016 to 3/15/2017.,3/15/2017,Sale of facility to Centers Health Care,Plant Closing,Plant Closing,"1199 National Health and Human Services Employment Union, SEIU-UHWE and New York State Nurses Association","Melissa Nagelbush, Senior HR Manager",(347) 978-3980,,2016-0085,5861
"East End Bus Lines, Inc.3601 Horseblock RoadMedford, NY 11763",Student Transportation for Longwood and South Country School Districts,Suffolk County | WIB Name: SUFFOLK | Region: Long Island,255,255,3/15/2017,6/26/2017,6/26/2017,Possible contract lost with Longwood and South Country School Districts.,Possible Plant Closing,Possible Plant Closing,"Local 1205 – International Brotherhood of Teamsters, AFL-CIO","John Mensch, Owner",(631) 345-9600,,2016-0182,5860
"The Dumont NYC150 East 34th StreetNew York, NY 10016",Hotel services,New York | WIB Name: NEW YORK CITY | Region: New York City,79,79,3/16/2017,6/19/2017,6/19/2017,Economic,Plant Closing,Plant Closing,"UNITE HERE and New York Hotel & Motel Trades Council, AFL-CIO","Stephen Alfieri, Regional Director of Human Resources",(212) 465-3539,,2016-0183,5859
"Suffolk County National Bank (merger of SCNB into People's United Bank N.A.)4 West Second StreetRiverhead, NY 11901",Bank,Suffolk | WIB Name: SUFFOLK | Region: Long Island,67 (Total affected at both sites),57,10/28/2016Amended: 3/20/2017,"Separations will begin on April 1, 2017 and continue through December 31, 2017.",-----,"People’s United Financial, Inc., the holding company for People’s United Bank, N.A. is acquiring Suffolk Bancorp, the holding company for Suffolk County National Bank.",Plant Layoff,Plant Layoff,The affected workers are not represented by a union.,"Kathleen Spellman, Human Resources Manager",(631) 208-2314,,2016-0070,5858
"Bostwick Laboratories, Inc.100 Charles Lindbergh BoulevardUniondale, NY 11553",A full-service laboratory specializing in uropathology.,Nassau County | WIB Name: HEMPSTEAD | Region: Long Island,128,128,3/13/2017,5/1/2017,5/1/2017,Sale of business,Possible Plant Closing,Possible Plant Closing,The affected workers are not represented by a union.,"Jerry Diffley, Chief Operating Officer/Chief Compliance Officer",(516) 512-5213,,2016-0181,5857
"Cenveo CorporationBuffalo Quality Park Envelope Facility100 Centre DriveOrchard Park, NY 14127",Management and distribution of print and related offerings.,Erie | WIB Name: ERIE | Region: Western Region,111,111,2/17/2017Amended: 3/17/2017,"Most employees affected by the plant closing are expected to be permanently laid off between April 17, 2017 and May 18, 2017.","Facility operations will close between April 17, 2017 and June 16, 2017.",Economic,Plant Closing,Plant Closing,The affected workers are not represented by a union.,"Dean Allison, Regional Director of Human Resources","(814) 944-6881, ext.208",,2016-0154,5856
"Linden Care, LLC130 Crossways Park Drive, Suite 130Woodbury, NY 11797",Concierge pharmacy services,Nassau | WIB Name: OYSTER BAY | Region: Long Island,58,29,3/15/2017,6/15/2017,-----,Economic,Plant Layoff,Plant Layoff,The affected workers are not represented by a union.,"Jeffrey Pai, Human Resources Manager",(516) 422-8440,,2016-0179,5855
"J.C. Penney Corporation, Inc. Pallisades Center Mall1403 Palisades Center DriveWest Nyack, NY 10994",Retail Store,Rockland County | WIB Name: ROCKLAND | Region: Mid-Hudson,89,89,3/16/2017,6/18/2017,6/18/2017,Economic,Plant Closing,Plant Closing,The affected workers are not represented by a union.,"Robert Campbell, General Manager",(845) 348-0382,,2016-0178,5853
"JC Penney Corporation, Inc. 600 Sunrise MallMassapequa, NY 11758-4392",Retail Store,Nassau County | WIB Name: OYSTER BAY | Region: Long Island,117,117,3/15/2017,6/18/2017,6/18/2017,Economic,Plant Closing,Plant Closing,The affected workers are not represented by a union.,"Valerie L. Tehranchipour, General Manager of Sunrise Mall Store",(516) 795-3600,,2016-0177,5852
"Sodexo, Inc. (Stony Brook University)Mail Code 2020-Grn. Bldg.Gym RdStony Brook, NY 11794-2020",Food Services Operations,Suffolk County | WIB Name: SUFFOLK | Region: Long Island,391,391,3/8/2017,Separations will occur on or about 6/30/2017. Management separations will occur on 7/30/2017.,7/1/2017,Possible contract loss to provide campus dining services.,Possible Plant Closing,Possible Plant Closing,LOCAL 1102 RWDSU UFCW,"Curtis Stancil SPHR, SHRM-SCP, Human Resources Business Partner Director University Segment Northeast Region",(860) 546-6547,,2016-0176,5851
"Genpak, LLC68 Warren StreetGlens Falls, NY 12801",Manufactures a range of single-use packaging for the food industry.,Warren | WIB Name: SAR/WAR/WAS | Region: Capital,55,55,3/13/2017,7/10/2017,7/10/2017,"Facility moving to Charlotte, North Carolina.",Plant Closing,Plant Closing,The affected workers are not represented by a union.,"Catherine M. Sawchuk, Director of Human Resources",(518) 798-9511,,2016-0175,5850
"Public Health Solutions (Early Intervention Service Coordination Program) 1360 Fulton Street Brooklyn, NY 11201",Early Intervention Service Coordination Program,Kings | WIB Name: NEW YORK CITY  | Region: New York City County: New York | WIB Name: NEW YORK CITY  | Region: New York City County: Queens | WIB Name: NEW YORK CITY  | Region: New York City County: Bronx | WIB Name: NEW YORK CITY  | Region: New York City,80 (total affected at all four locations),30,3/3/2017,6/30/2017,6/30/2017,Economic,Plant Closing,Plant Closing,The affected  workers are not represented by a union.,"Tom Salvo, Vice President of Human Resources",(646) 619-6410,,2016-0171,5846
"A.I. Friedman, L.P.44 West 18th StreetNew York, NY 10011","Art, Computer and Office Supplies",New York | WIB Name: NEW YORK CITY | Region: New York City,79,27,3/1/2017,Possible layoffs may begin on 5/30/2017 or thereafter.,TBD,Economic,Possible Plant Unit Closing,Possible Plant Unit Closing,UAW - Local 2179,"Rose Lyons, Human Resources & Facilities",(212) 337-8619,,2016-0164,5845
"Savers (Thrift Store)1175 Marketplace DriveHenrietta, NY 14623",Thrift Store,Monroe County | WIB Name: MONROE | Region: Finger Lakes,58,58,3/2/2017,6/2/2017,6/2/2017,Economic,Plant Closing,Plant Closing,The affected workers are not represented by a union.,"Theresa Moss, Director of Team Member Relations and Employment Law Compliance",(425) 456-1735,,2016-0170,5844
"Public Restaurant LP dba PUBLIC(AvroKO Hospitality Group)210 Elizabeth StreetNew York, NY 10012",Restaurant,New York | WIB Name: NEW YORK CITY | Region: New York City,55,55,3/2/2017,6/3/2017,6/3/2017,Economic,Plant Closing,Plant Closing,The affected workers are not represented by a union.,"Dan Fafalin, Principal, AvroKO Hospitality Group",(212) 343-7011,,2016-0169,5843
"CLSA Americas, LLC1301 Avenue of the AmericasNew York, NY 10019","Provides equity research, sales, and execution services.",New York | WIB Name: NEW YORK CITY | Region: New York City,142,63 (US Equity Sales and Research Unit),3/3/2017,2/27/2017,2/27/2017,Economic,Plant Unit Closing,Plant Unit Closing,The affected workers are not represented by a union.,"Gregg Rieber, Head of Human Resources",(212) 549-0169,,2016-0168,5842
"CVS Pharmacy, Inc.(Office)80 Red School House Road, Ste. 226Chestnut Ridge, NY 10977",Pharmacy,Rockland County | WIB Name: ROCKLAND | Region: Mid-Hudson Region,99,99,3/2/2017,5/31/2017,5/31/2017,Economic,Plant Closing,Plant Closing,The affected workers are not represented by a union.,"Kimberly Spooner, Director, Human Resources LTC",(813) 344-6988,,2016-0166,5840
"Sodexo, Inc. (Houghton College)1 Willard AvenueHoughton, NY 14744",Food Service Operations,Allegany County | WIB Name: ALL/CAT | Region: Western Region,-----,38,2/24/2017,Separations will occur for non-management employees on 5/31/2017 and management separations will occur on 6/30/2017.,5/31/2017,Loss of contract,Plant Closing,Plant Closing,The affected workers are not represented by a union.,"Curtis Stancil SPHR, SHRM-SCP, Human Resources Business Partner Director University Segment Northeast Region",(860) 546-6547,,2016-0167,5839
"ComplexCare Solutions Medical Practice, PLLC(Care Management Department)55 Broad St.New York, NY 10004",Provide assessment and care management services for health plans.,New York | WIB Name: NEW YORK CITY | Region: New York City,466,113,2/28/2017,The separations will begin on 3/3/2017 and expected to end 5/31/2017.,5/31/2017,Loss of contract,Plant Layoff,Plant Layoff,The affected workers are not represented by a union.,"Heather Brown, Senior HR Generalist",(615) 933-4603,,2016-0165,5838
"Data Listing Services (Jamestown), LLC dba The Connection1010 Wayne StreetOlean, NY 14760",Call Center,Cattaraugus | WIB Name: ALL/CAT | Region: Western Region,-----,"174 - Since the original notice of 146 affected workers, there were 30 workers that left prior to their original layoff date. An additional 58 workers were provided notice on 2/16/2017.",10/10/2016Amended: 2/16/2017,Terminations will take place from 1/8/2017 through 5/17/2017.,5/17/2017,Loss of Contract,Plant Closing,Plant Closing,The affected workers are not represented by a union.,"Cyndi McDurmott, Vice President, Human Resources",(952) 948-5353,,2016-0061,5837
"Pfizer, Inc.64 Maple StreetRouses Point, NY 12979",Pharmaceuticals (production),Clinton | WIB Name: C-E-F-H | Region: North Country,114,5,3/1/2017,5/27/2017,10/31/2017,Economic,Plant Closing,Plant Closing,Local 95c ICWU/UFCW,"Daniel Naiman, SR. Director of Human Resources",(212) 733-2110,,2016-0163,5836
"NRG Energy, Inc. (Bohemia Office)170 Wilbur Place, Suite 100Bohemia, NY 11716",Power Plant,Suffolk | WIB Name: SUFFOLK | Region: Long Island,81,81,2/20/2017,The separations will occur between 5/24/2017 and 6/23/2017.,6/23/2017,Economic,Plant Closing,Plant Closing,The affected workers are not represented by a union.,"Jarred Finamore, Human Resources Manager",(732) 430-2368,,2016-0162,5835
"Vodafone Americas560 Lexington AvenueNew York, NY 10022",Telecommunications - Mobile Products,New York | WIB Name: NEW YORK CITY | Region: New York City,51,51,2/23/2017,Layoffs will begin on or about 2/24/2017. Additional separations will occur on or about 6/30/2017.,6/30/2017,Consolidation of functions,Plant Closing,Plant Closing,The affected workers are not represented by a union.,"Heather Wootton, HR Business Partner - Americas",(917) 596-0103,,2016-0161,5834
"Will Foods, LLC  1075 William Street  Buffalo, NY 14206",Food distribution,Erie | WIB Name: ERIE | Region: Western Region,71,71,2/23/2017,"February 24,  2017 (12 affected), March 3, 2017 (4 affected), March 10, 2017 (3 affected),  March 17, 2017 (43 affected) and March 24, 2017 (9 affected)",3/24/2017,Economic,Plant Closing,Plant Closing,The affected workers  are not represented by a union.,"John C. Manley, Jr., President & CEO",(716) 853-2000,,2016-0160,5833
"NRG Energy, Inc.614 Corporate Way, Suite 4Valley Cottage, NY 10989",Power Plant,Rockland County | WIB Name: ROCKLAND | Region: Mid-Hudson Region,50,50,2/20/2017,The separations will occur between 5/24/2017 and 6/23/2017.,6/23/2017,Economic,Plant Closing,Plant Closing,The affected workers are not represented by a union.,"Jarred Finamore, Human Resources Manager",(732) 430-2368,,2016-0159,5831
"Kraft Heinz Foods Company8600 Main StreetCampbell, NY 14821","Produces Polly-O’String cheese, mozzarella cheese and other Italian cheese varieties.",Steuben | WIB Name:CSS | Region: Southern Region,380,380,2/21/2017,5/26/2017,7/31/2017,Economic,Plant Closing,Plant Closing,"International Brotherhood of Teamsters, Local 529","Eric Meszaros, Associate Director-Human Resources",(847) 646-8067,,2016-0158,5830
"Eastman Kodak Company (Kodak Office)343 State StreetRochester, NY 14650",Photographic equipment and supplies,Monroe | WIB Name: MONROE | Region: Finger Lakes Region,-----,3,2/16/2017,5/16/2017,-----,Economic,Plant Layoff,Plant Layoff,The affected workers are not represented by a union.,"Pamela J. Fantauzzo, HR Specialist",(585) 724-7080,,2016-0156,5829
"Gracious Home1992 BroadwayNew York, NY 10023",Home goods retail,New York | WIB Name: NEW YORK CITY | Region: New York City,114 (total number afftected for all three sites),36,12/13/2016 Amended: 2/13/2017,12/18/2016,12/18/2016,Economic,Plant Closing,Plant Closing,The affected workers are not represented by a Union.,"Jenna Everhart, Director, Human Resources",(212) 606-4873,,2016-0110,5827
"Sabra Dipping Company535 Smith StreetFarmingdale, NY 11735",Perishable Prepared Food Manufacturing,Nassau | WIB Name: OYSTER BAY | Region: Long Island,22,22,2/16/2017,"Most employees will be separated effective May 16, 2017, with the other few employees being separated between May 17, 2017 and on or about June 30, 2017.",6/30/2017,Economic,Plant Closing,Plant Closing,The affected workers are not represented by a union.,"Alyson Carroll, Human Resources Director",(804) 481-6404,,2016-0155,5826
"Cenveo CorporationBuffalo Quality Park Envelope Facility100 Centre DriveOrchard Park, NY 14127",Management and distribution of print and related offerings.,Erie | WIB Name: ERIE | Region: Western Region,111,111,2/17/2017,"Employees affected are expected to be permanently laid off between March 1, 2017 and May 18, 2017.","Facility operations will close between February 17, 2017 and June 16, 2017.",Economic,Plant Closing,Plant Closing,The affected workers are not represented by a union.,"Dean Allison, Regional Director of Human Resources","(814) 944-6881, ext.208",,2016-0154,5825
